title,post,author,upvotes,is_ls
Podcast post production,"I’ve been asked to do post production on a friend’s podcast. There were three people each on an SM58 recorded into a Zoom hard disc recorder in a flat (apartment) with no acoustic treatment.

As I’ve put compression on them, it’s all started to sound a bit boxy as the room bleed has been picked up by each other’s mics. I tried gating but the signal strength varies so much as they move back and forth from the mic that it cuts too much out or does nothing at all.

I’ve EQed each channel but the box I was is coming from the mics that aren’t in use at that time. The podcast is 45 mins long so too long to do automation. Anybody got any ideas to get a decent sound (save re-recording the whole thing in an actual studio!)

All help much appreciated!",t2_16m94oo,1,0
"Gear Recommendation (What Should I Buy?) Thread - November 26, 2018","Welcome to our weekly Gear Recommendation Thread where you can ask /r/audioengineering for recommendations on smart purchases.

Low-cost gear and purchasing recommendation requests have become common in the AE subreddit. There is also great repetition of models asked about and advised for use. This weekly post is intended to assist in centralizing and answering requests and recommendations.  If you see posts that belong here, please report them to help us get to them in a timely manner.  Thank you!

Daily Threads:


* [Monday - Gear Recommendations Sticky Thread](http://www.reddit.com/r/audioengineering/search?q=title%3Arecommendation+author%3Aautomoderator&amp;restrict_sr=on&amp;sort=new&amp;t=all)
* [Monday - Tech Support and Troubleshooting Sticky Thread](http://www.reddit.com/r/audioengineering/search?q=title%3ASupport+author%3Aautomoderator&amp;restrict_sr=on&amp;sort=new&amp;t=all)
* [Tuesday - Tips &amp; Tricks](http://www.reddit.com/r/audioengineering/search?q=title%3A%22tuesdays%22+AND+%28author%3Aautomoderator+OR+author%3Ajaymz168%29&amp;restrict_sr=on&amp;sort=new&amp;t=all)
* [Friday - How did they do that?](http://www.reddit.com/r/audioengineering/search?q=title%3AFriday+author%3Aautomoderator&amp;restrict_sr=on&amp;sort=new&amp;t=all)
",t2_6l4z3,8,0
"Tech Support and Troubleshooting - November 26, 2018","Welcome the /r/audioengineering Tech Support and Troubleshooting Thread.  We kindly ask that all tech support questions and basic troubleshooting questions (how do I hook up 'a' to 'b'?, headphones vs mons, etc) go here.  If you see posts that belong here, please report them to help us get to them in a timely manner.  Thank you!

   Daily Threads:


* [Monday - Gear Recommendations Sticky Thread](http://www.reddit.com/r/audioengineering/search?q=title%3Arecommendation+author%3Aautomoderator&amp;restrict_sr=on&amp;sort=new&amp;t=all)
* [Monday - Tech Support and Troubleshooting Sticky Thread](http://www.reddit.com/r/audioengineering/search?q=title%3ASupport+author%3Aautomoderator&amp;restrict_sr=on&amp;sort=new&amp;t=all)
* [Tuesday - Tips &amp; Tricks](http://www.reddit.com/r/audioengineering/search?q=title%3A%22tuesdays%22+AND+%28author%3Aautomoderator+OR+author%3Ajaymz168%29&amp;restrict_sr=on&amp;sort=new&amp;t=all)
* [Friday - How did they do that?](http://www.reddit.com/r/audioengineering/search?q=title%3AFriday+author%3Aautomoderator&amp;restrict_sr=on&amp;sort=new&amp;t=all)
",t2_6l4z3,4,0
"Is there a way to make my speakers reverse audio? Like left plays right, and vice versa.",The wires don't reach far enough to switch them to be in the right place. So i was wondering if there was software to fix this problem.,t2_mysfh,0,0
Roland RE-501: what to look for when assessing condition,"Hey there,

Looking at buying a used RE-501 locally. The seller is the original owner and has cleaned the heads regularly, but otherwise it hasn't been serviced in about 30 years. It look mint though, really nice condition, and sounds good.

So, two questions:

1) Anything in particular I should look for when assessing its condition?

2) What should I plan on doing to maintain it after purchasing? Never owned one of these.

Thanks!",t2_1ds1e8,1,0
"Arranging a track that is mostly guitars, tone, effects, etc.","Hey guys,

I am working on some tracks that have most of their harmonic content coming from guitars ( 2+ different chord inversions, and rhythms of extended chords, and one bass guitar). This is more of a general question, but I am wondering how you fill out an arrangement for a song that is mostly guitar? To my ears, there's a certain narrowness to the electric guitar playing chords that something like an electric piano Rhodes sound doesn't have. Narrow in width but also frequency content. A thinness that a few interlocking synth chords doesn't have. When combined in a full arrangement, with keys and maybe strings or pads and other instruments, guitars do a nice job of accentuating certain parts of the harmony through chord stabs and fills, but when it is just guitar, it seems to not fill the wide frequency range that a piano or keys would, and it also doesn't have an attack that naturally lends itself to 'holding down' an arrangement as well either. And this is coming from someone who has played guitar for 15 years. I know my instrument and I know it's short comings. I am also wondering how you manage arrangement situations as far as what effects, and 'differences' you put on the guitars to make them fill out an arrangement - or what playing style in comparison to the other you encourage.So how do you deal with a creating a song that has that fullness but is harmonically carried only by electric guitars?

Thanks!

&amp;#x200B;

EDIT: Im going for a sort of R&amp;B/Soul/smooth jazz sound. A lot of guitar recommendations for production come for things that in my head make sense in a two distorted guitar panned hard type scenario, sort of a rock/metal world if you will. And that's cool. I've done that to success before. But I'd rather have someone think in the lines of these genres I'm mentioning (which in my mind rely heavily on the E.Piano sounds to carry the harmony) and think again how this can be achieved with just guitars. Thanks!",t2_4nja4,1,0
What do you all use for sound absorption/diffusion?,"Hi everyone, sorry in advance if this isn’t the right sub to post this in. 
I have a second story garage ‘studio’ that needs some TLC as far as sound absorption goes. This space is used as a practice area for my band, as well as where I work on editing music. Of course, no young persons studio is complete without a neighbor who absolutely hates the sound leakage. I know the first thing people might recommend is to find a new place to practice, but at this time that’s not an option for me, unfortunately. I understand that there’s no way to completely soundproof the room, but I have a very thick blanket in front of and around the drums and I recently purchased some safe n sound rockwool, which I’m planning on making panels with this week. I’m sure some people here have made some panels with rockwool, so I was mainly wondering what kind of fabric will work best for wrapping the panels once the frames are built. This is important for me to know as I’ve heard a lot of different suggestions. 

Also if you guys have any other suggestions as to what I could do to contain some (or most) of the sound, I’m open to anything! My band stops practice at 9, since the town I live in has no sound ordinance, so we abide by the sound law of the state that we live in. My neighbor must have crazy good hearing because when I stood outside while my drummer played, I could barely, and I mean barely hear the drums, which seem to be the main problem. However I am saving up for some curtains that should help a lot. Bass and guitar volume are kept at the bare minimum they need to be at to accommodate the drums. Mixing isn’t really a problem as far as the neighbor hearing it because I don’t need to mix at a high volume. I’m just trying to have a productive band practice without upsetting anybody. 

Thanks for reading, and sorry for the long post. I look forward to hearing what you guys have to say! ",t2_wyoqu,1,0
Hey! I need tips/feedback (no pun intended) on a session I got tomorrow regarding mic placement mostly.,"**The Instrument:**

One solo B^b clarinet (possibly also the same guy playing an E^b for other pieces)

**The Hardware:**

I have the following at my disposal: 

- Audix i5 (x1)
- Audix D6 (x1)
- Audix D2 (x2)
- Audix D4 (x1)
- Audix ADX51 (x2)
- Shure SM57 (x1)
- MXL V250 (x1)

**The Software** which I doubt matters:

Logic Pro X (yeah I know)

**The Room:**

Not many details on this. I'm given to understand it's made for medium-sized choral performances and acoustically 'treated' for such purposes. 

**The Purpose:**

It's for an audition tape, so it doesn't have to be stellar quality. I do want it to be good though, and I think it needs to be/want it to be achieved through good mic placement first and foremost.

**The Plan:**

- mic clarinetist with the MXL V250, since I think a large-diaphragm condenser mic is gonna get the best frequency range
- place MXL V250 about a foot away from the upper center of the instrument itself, because the player tends to move around when he's performing and because I'm given to understand that placing the mic upwards of center is going to deliver the best sound (other than that I only really know that mic'ing the bell is a bad call)
- Possibly place the ADX51s in XY at a height of about 6-6.5' behind the performer to capture the room ambience, depending on how the room sounds (this is my biggest point of uncertainty, I'm not sure if rear placement is good or if I should place them in the opposite end of the room or anything like that)

Anything you can tell me about what I'm doing right or wrong would be of massive help! I'm looking for any and all input on techniques of any relevant kind really, I'm new to this whole sort of thing. I have looked into this matter a decent bit online but I've only found tons of videos that don't go particularly in-depth and most of them say different things. I like to ask questions and interact with real people, hence why I'm posting here.

Cheers :)",t2_nybj0,33,0
Issues with live drums: drum and bass producer,"I make drum and bass which consists basically of drums, both synthesized and acoustic, and bass (synthetic, not acoustic).

My goal is to get decent at making breaks (using drum software like superior Drummer 3 to make pseudo recordings of real drumming) to use in songs. I don't need the acoustic drums to be as heavy as synthesized ones, I just need them to not disappear completely in the mix yet not be super synthetic. I can't overstate how loud my songs are. But I also don't want to be using dubstep snares at 170+ BPM. Drum breaks give some life to extremely mechanical music.

I'm decent at most other engineering stuff so thats not the issue. Overall, I can get satisfying mixes if using synthesized elements only for bass + drums.

 I have a hard time getting acoustic drums to sound good. 

Summary:

I have a hard time getting some loudness/harmonic content out of raw drums without obliterating the naturalness of the recording. I have no clue how other producers can make such excellently processed acoustic drums.

Issues with body/tail:

They're either too boomy with long tails if I enable bleed and use surround channels, or they are too fake sounding if I use volume envelopes. Release times for kicks/Tom's are super long by default, it's hard to get things snappy enough for high BPMs yet not fake 

Frequency spectrum issues:

The raw drum sounds are very quiet in a heavy song: little top end, low peaks, etc. So I will add some distortion ranging from tube to tape to waveshaping. But then everything just sounds harsh.

I'm using superior Drummer 3 which should give me enough technical choices to not have these issues so I think the real issue is just skill. I have more tools at my disposal than most famed engineers of the past. Basically anything that can be done with drums, I can do easily, except I am a drum noob.

Any advice on making drums sound better? I really have no experience mixing anything synthetic and it shows in my mixes. Should I just watch pensado for a while? Thanks",no author,0,0
old school CAD mics?,"Do any of you guys have experience with the older ""Made in the US"" CAD mics, like e200, e300, e350, VSM-1 and VX2?

There isn't a lot of info on these, but the few things I've seen about them is they are night/day from CAD's current offerings.

Any recordings of these online?",t2_msh7rvr,1,0
Who here uses Izotope for mastering? What’s in your chain and in what order?,"Mastering isn’t my strong suit, but I can at least get my tracks sounding how I want them to sound finished and at a good level. 

For awhile, my chain went EQ, dynamics, exciter (minimal usage), stereo imager, then maximizer. I noticed basically no matter what level of limiting/maximizing (within a “normal” loudness threshold, and even quite a bit lower), my master always had some minimal clipping when played on a phone or laptop speakers, even with little to no gain reduction from the limiter. 

It wasn’t until I messed around and started putting the exciter before the compressor/dynamics that it went away. I wish I’d known sooner. 

Anyone have any other tips/pointers/best practices that might help myself or others using Izotope?",t2_l0dwv,84,0
Sonarworks Reference 4: Is it possible to do a recursive test with applied correction curve?,"Doing a secondary measurement using the correction curve from the initial measurement would be useful to verify the success of the whole process. However, I haven't been able to find such an option in the software itself. Any idea for a workaround to make this possible? Thanks in advance!",t2_4ja4u,1,0
Difference between left and right headphones piece,"Hi everybody.  


Recently I bought Presonus HD7 headphones and I noticed a *slight* difference between left and right piece.  
Right one is more bass heavy while left one is a bit more airy.   
For example, when I play some 808s it seems like the 808 is sitting a little more to the right from the center.   


This is a second pair of these headphones that I got, returned the previous pair because the left piece was (kind of) blown out and was crackling sometimes, so the difference was even more pronounced.   


Any thoughts? ",t2_ialx09p,1,0
"I recorded someones vocals tonight and they sucked, How do i tell them nicely?","Hey guys, So tonight i had someone over who had wanted me to record his vocals for a long time now, And as soon as they started i knew exactly what was wrong! They still had not found their voice yet, still using the inside voice almost as if they could not perform over a certain volume.

And this is normal for a beginner from what i have seen, But how do i tell him? it's his first time i don't want to just throw demands at him so straight out the gate like that, But he thinks just because he hears stuff i have made that is good i can just magically make his recordings sound good with editing.

He has potential and his lyrics sounded good on paper but just don't want to be to harsh so soon as it may discourage him, So i call upon you wise Engineers to grant me advice of the subject.


",t2_2m0e4mt4,164,0
Need help syncing two audio files together,"So last night I mixed a show and did a recording from two different sources. One off my board and one from room mics. I hit record at different a couple of seconds apart and ended the same way. I spent hours trying to put them together in my Logic Pro, but they are always off. Is there any tool that could help me? ( also, I have pro tools and ableton if that matters )",t2_hrqv6,2,0
Ear Fatigue Shower Thought,"1.) Does the constant rumble and noises of daily living introduce some level of ear fatigue?

If not...

1a.) What is the decibel threshold where ear fatigue begins?

1b.) Would wearing earplugs all the time except when working on audio change the way your brain perceives sounds?",t2_xm6ls,33,0
Tips on metalcore mixing?,"So, I'm a punk rock kind of guy, until now I've worked with mostly punk rock. But now, I have this metalcore / post hardcore song to mix. I'm mixing it, taking Archtects as the main reference. Took me a long time to understand how to work with the low reamped guitars and bass... It's sounding good, but I still feel like it could be a bit better. The low end of my kick drum is hitting at 50 hz, my bass at 60 (in punk rock I usually boost around 100) and I'm compressing some low frequencies of the guitars. I think I got the low end just right, but my problem is... How to make the guitars stand out just a bit, without sounding too harsh for the style of music.

Do you guys have any tips on that matter? Also accepting tips for bass, specially about it's high end, since it seems to me the bass is not supposed to be actually heard, but more like to be felt...

Any tips would help! Looking foward to learn more about the genre :-)",t2_d6y77y,8,0
How do you guys maintain uniformity on a project?,"Not like, how do you literally do it, but, how do you guys like to personally keep track of the mixes in a project ie album so it all sounds the same?

When doing these things, I usually just save channel strips on logic and apply the presets to the same instruments in the same song, and tweak as necessary. I’ve thought about starting spreadsheets to get even more detailed, for example, song 1, kick drum track peaking at -6db, song 2 kick drum track peaking at -8db. Basically extensive note taking.

Do you guys prefer taking notes or are you better at keeping track with your ears or from memory?",t2_lh38z,70,0
Good place for impulse responses?,Anyone know a good place to get either free or paid impulse responses? Looking to build a collection up.,t2_bnrr8,1,0
Annoying Gain Staging Question,"Hi All - 

Something's been stuck on my mind regarding gain staging. I fully understand the concepts of gain staging, headroom, analog domain, -18dbfs = 0VU, etc. We all know that it's important to give yourself plenty of headroom and have proper levels running into analog-modeled plugins... my question is, in the digital DAW realm, is it possible to have too low levels running into these plugins?

For instance, can you run your levels too low, say into an analog modeled channel strip, that the signal is no longer picks up the sonic influence, or ""analog sound"" of the plugin? Or are we fine just clip gaining everything down to get to a reasonable level (0VU) on the mix buss and call it good, when perhaps the high hat layer is sitting at -12VU, far below the ""ideal working conditions"" of the plugin? 

Just pondering.. thanks for your thoughts :)",t2_ist2j,1,0
How do you guys deal with 808/Kick Balance?,"This is mainly from the view of mixing hip-hop/trap, but I'm curious if anyone's come across any cool combinations or ways to mix kicks and 808's for great balance and tone.",t2_5fk3lfu,12,0
"Voodoo of a minimalistic, but full sounding track?","Hi folks,

I'm curious about how would you solve a situation where in a track there are quite few channel like basic drums, bass, lets say that an acid lead and some bits of random/non-repetitive fx to keep it i teresting, but overall there is nothing too busy going on and you want the mix to sound more full, but without adding 100 more instrument channels which would distract from the main theme of the song.  

I think Mathew Jonson is quite a good example for that in many cases. 

What would be your approaches for this situation? 

I'm not giving any examples of plugins or whatever, cause might bias your own approach.

Cheers! ",t2_iwvw3jo,57,0
Is phase cancellation acceptable if it's working on a subtle sounds and used to fill out the stereo spectrum?,I'm starting to experiment with subtly mixing only side channels (200% width) into sounds to try and fill out the stereo image and I'm wondering if this is a good idea or not. The sounds I'm mixing like this are super quiet so when summed to mono I don't think there's a lot of cancellation. Is a phase correlation of ~-1 ok to use when filling out the sides or should one always try to keep ~0?,t2_gfkig,1,0
"Why when isolating the side channel, the L and R channels are almost always perfectly out of phase?",Is it because if they were playing the same thing that would be considered mid and so you only hear parts with a phase correlation of -1? ,t2_gfkig,0,0
What kind of tape is this?,"[Photo](https://imgur.com/gallery/YHmAKZt)

This tape supposedly contains an interview between my grandfather who worked in the radio business his whole life after WW2 and his son who was a Marine during Vietnam before being a cop. 

I’m not confident of it being in good condition.  It was kept out in the open before it was given to me. 

How do I go about getting it in a digital format? 

Thanks.
",t2_25ol3je1,9,0
Black Friday Ultrathread,"Comment here with all your deals and sales.

No affiliate links, please. Try not to use link shorteners, because Automod will eat your comment.

P.S. Why is it an ultrathread, you ask? Because it combines two megathreads; Black Friday *and* Cyber Monday.",t2_brbtr,127,0
"Friday - How did they do that? - November 23, 2018","Post links to audio examples that are apparently created by magic. 

Please post specific links in the timeline if applicable.

  Daily Threads:


* [Monday - Gear Recommendations Sticky Thread](http://www.reddit.com/r/audioengineering/search?q=title%3Arecommendation+author%3Aautomoderator&amp;restrict_sr=on&amp;sort=new&amp;t=all)
* [Monday - Tech Support and Troubleshooting Sticky Thread](http://www.reddit.com/r/audioengineering/search?q=title%3ASupport+author%3Aautomoderator&amp;restrict_sr=on&amp;sort=new&amp;t=all)
* [Tuesday - Tips &amp; Tricks](http://www.reddit.com/r/audioengineering/search?q=title%3A%22tuesdays%22+AND+%28author%3Aautomoderator+OR+author%3Ajaymz168%29&amp;restrict_sr=on&amp;sort=new&amp;t=all)
* [Friday - How did they do that?](http://www.reddit.com/r/audioengineering/search?q=title%3AFriday+author%3Aautomoderator&amp;restrict_sr=on&amp;sort=new&amp;t=all)

     Upvoting is a good way of keeping this thread active and on the front page for more than one day.
",t2_6l4z3,3,0
How to isolate dialogue recorded on a ZOOM and lav mics?,"Basically, I have three clips that the lav and also the zoom is jostled while the speaker is talking (small bumps, snaps). Is there a solution for isolating the dialogue without going broke on an 800$ plug-in?",t2_27pd4et4,0,0
History Question: why are old recordings so overdriven?,"I think this every year when I start listening to Christmas music, finally gonna ask someone. I’m not an pro audio engineer but I understand a bit.

Many old audio recordings (actually old, like 30s &amp; 40s; consider Bing Crosby’s early stuff) sound overdriven, but why is that? What were the OG audio engineers doing “wrong” and what improvements in recording equipment and techniques most corrected that problem?

I’m specifically wondering where the problem(s) were in the process. Were microphones just that bad and over-sensitive back then? Was it that the amps and preamps couldn’t handle any substantial signal? Did engineers not understand clipping? I’ve heard compression technology wasn’t utilized for a long time; was “loud parts clip” just the accepted trade-off for “gotta hear the quiet parts”? Was it a limitation of the tapes or vinyl being recorded to? Or is it some inherent issue in re-recording to newer formats (i.e. there was no distortion on the original record, but it showed up when they started transferring to CDs, etc)?

Thanks friends! Looking forward to learning something new today :)",t2_uzx1qho,94,0
Working with processed samples : what to take in consideration?,"Something i have been thinking about lately as recently i have gotten a lot of sample based drums from clients. What are some things to take into consideration when working with processed samples? Usually the samples tend to come out of samplepacks that are commonly processed with Compression, distortion, transient designers.

The approach will vary on the song/composition and the samples.
But from a theoretical standpoint what are some things to be aware of or to watch out for that i might have not thought about myself?
",t2_135eu1,1,0
In what ways do you like to use sidechaining in a mix?,"I sidechain snare top to a gate on my snare bottom. I've also been doing kick chained to bass using a dynamic EQ, and I've done some experimentation sidechaining lead vocals to compressors on effects to duck them a bit while the vocalist is singing.

I'm curious to hear how you all have implemented sidechaining (multiband or not) into your workflows.",t2_deunt,7,0
How do I make a piano instrument echo?,I'm using the piano in ableton live and need to make the sounds ring for a long time. What effect do I need to use? Would I be able to do it with the effects the Ableton live comes with or should I use a different plugin. If I got another plugin should I use an effect or a different piano instrument with more sounds?,t2_xpzln,0,0
"Listened to an LA-2A shootout, and I feel conflicted.","The shootout was between the Teletronix LA-2A, warm audio's WA-2A clone, and the waves CLA-2A plugin. I gotta say. I was considering picking up a warm clone, but after hearing the Teletronix, I feel like getting the WA-2A would be a disservice to myself.

Have any of you had similar experiences when comparing gear? What was your course of action afterwards?",t2_deunt,4,0
