title,post,author,upvotes,is_ls
"Tech Support and Troubleshooting - December 10, 2018","Welcome the /r/audioengineering Tech Support and Troubleshooting Thread.  We kindly ask that all tech support questions and basic troubleshooting questions (how do I hook up 'a' to 'b'?, headphones vs mons, etc) go here.  If you see posts that belong here, please report them to help us get to them in a timely manner.  Thank you!

   Daily Threads:


* [Monday - Gear Recommendations Sticky Thread](http://www.reddit.com/r/audioengineering/search?q=title%3Arecommendation+author%3Aautomoderator&amp;restrict_sr=on&amp;sort=new&amp;t=all)
* [Monday - Tech Support and Troubleshooting Sticky Thread](http://www.reddit.com/r/audioengineering/search?q=title%3ASupport+author%3Aautomoderator&amp;restrict_sr=on&amp;sort=new&amp;t=all)
* [Tuesday - Tips &amp; Tricks](http://www.reddit.com/r/audioengineering/search?q=title%3A%22tuesdays%22+AND+%28author%3Aautomoderator+OR+author%3Ajaymz168%29&amp;restrict_sr=on&amp;sort=new&amp;t=all)
* [Friday - How did they do that?](http://www.reddit.com/r/audioengineering/search?q=title%3AFriday+author%3Aautomoderator&amp;restrict_sr=on&amp;sort=new&amp;t=all)
",t2_6l4z3,7,0
"Gear Recommendation (What Should I Buy?) Thread - December 10, 2018","Welcome to our weekly Gear Recommendation Thread where you can ask /r/audioengineering for recommendations on smart purchases.

Low-cost gear and purchasing recommendation requests have become common in the AE subreddit. There is also great repetition of models asked about and advised for use. This weekly post is intended to assist in centralizing and answering requests and recommendations.  If you see posts that belong here, please report them to help us get to them in a timely manner.  Thank you!

Daily Threads:


* [Monday - Gear Recommendations Sticky Thread](http://www.reddit.com/r/audioengineering/search?q=title%3Arecommendation+author%3Aautomoderator&amp;restrict_sr=on&amp;sort=new&amp;t=all)
* [Monday - Tech Support and Troubleshooting Sticky Thread](http://www.reddit.com/r/audioengineering/search?q=title%3ASupport+author%3Aautomoderator&amp;restrict_sr=on&amp;sort=new&amp;t=all)
* [Tuesday - Tips &amp; Tricks](http://www.reddit.com/r/audioengineering/search?q=title%3A%22tuesdays%22+AND+%28author%3Aautomoderator+OR+author%3Ajaymz168%29&amp;restrict_sr=on&amp;sort=new&amp;t=all)
* [Friday - How did they do that?](http://www.reddit.com/r/audioengineering/search?q=title%3AFriday+author%3Aautomoderator&amp;restrict_sr=on&amp;sort=new&amp;t=all)
",t2_6l4z3,15,0
Will I EVER understand compression...?,"Ahh yes, my monthly compression post...

I 'get' the idea of compression but I am struggling SO much with how to hear what is reasonable/appropriate/too much when adding compression. Here's my understanding and PLEASE correct me on any or all of this:

Threshold: The point where the plug in actually kicks in.

Ratio: How much of the sound over the threshold is compressed.

Attack: Length of time before Compression kicks in

Release: How long compression is held for

Makeup Gain: Getting the 'lost' volume back from the compression.

I'm trying to start with understanding the Logic house compressors, I've picked one to learn, Studio FET. 

My problem is, I can see the needle move and know something is happening but I just can't tell if I've found a sweet spot. Am I monitoring the WHOLE track while getting the compressor right or picking a particular good point where there might be loud words or soft words and looping it till I get it right? 

I've watched tons of videos, explanations, animations, you name it but I just can't get to grips with it. I think I need some exercises that will let me practice compression. I have a lot of recorded vocals and acoustic guitar, so plenty to work with, I just need to know what I'm listening for and how to know when I've done it 'right'...which I know is subjective. 

Also another question I have is, do you treat your compression like a mathematical equation? I find myself trying to do maths with the radio and db's blah blah blah...

Thank you in advance.",t2_2r3uhjqr,96,0
I'm interviewing to be an intern at a big studio tomorrow.,"What questions should I ask?

Edit: I'm getting downvotes? Why?",t2_dd3qi,145,0
"If I faced two speakers towards each other, one playing a sound, and the other playing the inversion of that sound, and I sat halfway between them (one facing my face and the other the back of my head), would I just hear silence?",,t2_bl2x2,5,0
"How to get vox to ""sit"" in the mix?","I keep getting told on r/RateMyAudio that the vox doesn't sit well with the mix, but what does this mean, and how do I accomplish this?",t2_1q6rui4i,2,0
Rode NTA-1 Capsule Swap?,"Hey everyone,

I've used the same NTA-1 for about 7-8 years now, never modded it.

Now that I'm getting serious about music, I've been looking into how to upgrade it. 

I came across the RK-47 at mic parts. [https://microphone-parts.com/products/rk47-microphone-capsule](https://microphone-parts.com/products/rk47-microphone-capsule) 

My questions: 

Has anyone completed this swap? If so, does it make a difference significant enough to warrant the cost/labor? 

Finally, how difficult is the actual swap itself, is it a DIY project, or should I take it to someone?

Thanks in advance!",t2_zpd9q,1,0
Ever used Spectra Sonics?,The 610 and v610 were pretty neat complimiters. Anyone else use anything by them?,t2_1fywp7z4,1,0
Live Mixing Simulator,Is there such a thing as a live mixing simulator? I would like to get some practice and fiddle around without having to ruin many live shows that may count... A quick google search didn't give me anything. Does this exist at all??,t2_2d47m33x,3,0
Making a guitar amp,I am looking into making my own guitar amp for practice cause I don't want to pay for one. I can make a box and I know a brand that makes good drivers for cheaper. BUT i'm not sure about impeadence in guitars. I think it's around 1 mil and if I get a little chinese class D amplifier (which I plan to) the RCA level inputs I'm pretty sure are usually around 10k ohms but if I put an extra 10k ohm resistor in paralell with the guitar it should bring the impeadence down to around 10k ohms. Am I off my rocker or could that work?,t2_16ha9t92,0,0
How wide should a shockmount be for AT2020 XLR? My options are 43-47mm or 48-54mm.,Folks over from /r/audiophile said it's more appropriate to post this question here.,t2_hzm8n,1,0
"How do I know when a single sound is spectrally ""correct""?","Hi all! Thank you for your time!

I have a question that is more ""philosophical"" than technical.

How do I know when a single sound (or track) is ""ready"" or ""correct"" frequency-spectrum-wise? 
Is there any ""standard"" to satisfy every perception?
Is it just arbitrary? Or should I just reference it?

Two examples:

- I have this footstep on sand sound and I feel I should put an EQ on it because it doesn't sound like in the real life. I EQ it and I feel it is ok now. How do I know how much it is OK and ready to be put in a videogame? How do I know the high end is sparkly enough, for instance?

- I have this track and I reference it to another one in the same genre. I tweak it and now it sound very similar and very good to me. How can I trust that reference track of success? Why is it ok? Why is its spectrum good for everyone?

Thank you!",t2_40pgpt,52,0
Any FUN books you could recommend as gifts?,"My brother and I are both into home recording - he's 50 and knows what he's doing - doesn't need ""how-to"" books unless it was pretty unique. Are there any fun or interesting books on audio you like?",t2_cp8nt,0,0
Help for a total beginner (Increasing inputs to a Scarlet Solo),"So I'm just getting into recording in my tiny office, and was given an old scarlet solo from a friend! I'm a complete noob when it comes to audio, and have nearly no idea what I'm doing. As ya'll already know, the Scarlet Solo only has two inputs, a regular instrument cable and one XLR. So I am thinking about using a cheap mixer and just plugging its XLR out into the XLR input of the Scarlet solo so that way I had a little more control and didn't have to constantly try to fiddle with the tiny Scarlet Solo. Is this possible, or would it give too many latency issues? Is there any other work arounds you can suggest to increase the Solo's amount of ports?",t2_17habl,0,0
"Friday - How did they do that? - December 14, 2018","Post links to audio examples that are apparently created by magic. 

Please post specific links in the timeline if applicable.

  Daily Threads:


* [Monday - Gear Recommendations Sticky Thread](http://www.reddit.com/r/audioengineering/search?q=title%3Arecommendation+author%3Aautomoderator&amp;restrict_sr=on&amp;sort=new&amp;t=all)
* [Monday - Tech Support and Troubleshooting Sticky Thread](http://www.reddit.com/r/audioengineering/search?q=title%3ASupport+author%3Aautomoderator&amp;restrict_sr=on&amp;sort=new&amp;t=all)
* [Tuesday - Tips &amp; Tricks](http://www.reddit.com/r/audioengineering/search?q=title%3A%22tuesdays%22+AND+%28author%3Aautomoderator+OR+author%3Ajaymz168%29&amp;restrict_sr=on&amp;sort=new&amp;t=all)
* [Friday - How did they do that?](http://www.reddit.com/r/audioengineering/search?q=title%3AFriday+author%3Aautomoderator&amp;restrict_sr=on&amp;sort=new&amp;t=all)

     Upvoting is a good way of keeping this thread active and on the front page for more than one day.
",t2_6l4z3,1,0
The most insane/bizarre source of random noise I've ever come across....,"&amp;#x200B;

So and my brother DJ, quite a complex setup - two laptops, two controllers, synced via an Ethernet cable, audio from both laptops into a tiny little 2-channel mixer, which then goes into monitor speakers.

For a while things were pretty crappy, so we just put up with the random noise from the big monitor wedge we use. It's pretty crap, but it's fine for rehearsing and when we play live we use the club's PA system, so we'd rather spend our money elsewhere.

Yet today I introduced a new laptop to the setup, and the noise was insane - really loud, really weird, it sounded like someone had placed a tiny microphone in the CPU and amplified the volume 10000 times.

I narrowed it down to everything - it wasn't the new cables, wasn't the controller/audio interface, it wasn't the little mixer.

The source - the new laptop's charger. When I unplugged it, the noise vanished. Zero background noise, very clean audio

It was slightly quieter when plugging the laptop into a totally different socket on the other side of the room, but still there. The noise ALSO still happens when the mini-mixer had that laptop's channel MUTED! I really don't get it...

Anyone ANY ideas?",t2_o9395nv,21,0
EQ before or after the compressor?,"I’ve seen it done both ways. To me it always made sense to shape the wave frequencies after the signal itself has been compressed a little bit.  What are your preferences and why?

Edit: Thank you for the input! I meant this as a discussion on all our practices and preferences rather than asking what is right because I know there’s no rules, only guidelines.  Great feedback!",t2_16syhz,129,0
Can someone help explain these drivers?,"Backstory, I’m not familiar with audio hardware but have some ee background. I have some old Bluetooth speakers with crappy audio and thought about changing the drivers with a some I got out of a broken monitor. The old speakers were in a sealed enclosure with matching passive radiators.

The drivers I got out of the monitor are rectangular and have some confusing acoustics. The sound clear when you face the drivers, but without much bass. But if you point them down, you can hear more bass, but less clarity. If i try to build a little portable enclosure for them, would they need to be in an unsealed enclosure, use the passive radiators, pointed down, or forward, etc? Just curious if anyone who is a familiar with this type of driver what the acoustic considerations are. Thanks

http://imgur.com/a/nbOlvFw

",t2_16hacepx,6,0
Realistic Highball mics built by Shure: Rebranded SM58?,"I know Shure built various models of mics branded as Realistic for Radioshack , and was wondering if anyone has tested the different versions of the Realistic Highball (33-983, 33-984, 33-984A, B, C,etc...) , and how they compare to an SM58.",t2_2016o6fz,1,0
"How to write or build audio interface usb drivers for common DAW's (Logic, ProTools, Ableton, etc...)","I was wondering if anyone knew how to write or create a driver that allows a device to talk to any of the popular DAW's on the market.

At the moment, i'm designing a pre amp that I would like to eventually be used as an audio interface via usb and be recognized as an in/out when connected to a DAW. Basically a DIY focusrite.

If you have any links to learning resources those would be very much appreciated.

Thanks!",t2_2dhbz28,17,0
Will frequently turning phantom power on/off damage my equipment?,"Hi, I have an SM7B plugged into a Cloudlifter which then goes into a focusrite 6i6. If I turn the phantom power on/off, will it damage anything? The cloudlifter needs phantom power to work from what I understand, so it should just turn it off, right? 

I once joked with someone about using the phantom power switch on the interface as a ""mic on/off"" button and they said that it could damage the microphone. Would it?",t2_1071dyzy,3,0
Is there a specific reason why consumer microphones don't depreciate in price often?,"I'm taking a look at the Blue Yeti and the AT2020 - both have been around the same price the last 5-7 years. Is this an effect of consumerism or do you suggest we either:

A) don't have the audio tech to improve microphones around that price range

B) marginal benefit decreases, so there's no point in improving audio quality if most buyers won't notice a difference
",t2_f66jt,0,0
When Using EQ on dialogue does subtle work or is it necessary to make strong corrections.,I EQ dialogue and I usually make very subtle cuts and boosts (no more than 3db). Can the average listener actually hear this or am I wasting my time?,t2_k0u99,2,0
Why do guitar amp manufacturers advertise about how great their amps' bass frequency response is?,"It's relatively common for guitar amps to be advertised using phrases like ""huge, monstrous bass"" and other marketing terms regarding the impressiveness of how bass frequencies are reproduced by the amp. 

Is this a mere marketing gimmick oriented toward guitar players who either don't know or don't care how the amount of bass in their tone might interact negatively with the tone of the band's bassist? When guitar amp manufacturers advertise how great the bass response of their amp is, are they also necessarily referring to the extent to which their amp will compete with a bass guitar? 

I guess my question is whether an amp being advertised as having ""huge bass"" could translate into anything musically useful in the context of a band without necessitating that the bass guitar take up less space. If ""bass"" simply means frequencies from roughly 40 Hz to 300Hz, doesn't any advertisement about a guitar amps great bass presence mean that the bass guitar will have to be attenuated to compensate?",t2_9tmid,2,0
Mastering for Spotify?,"I've been working on a song for a friend of mine, and he wants to upload it to Spotify via Distrokid.

  
However, reading I've done suggests that spotify limits tracks to -14 LUFS, while the track I'm working on is currently peaking just under there. However, it is \*very\* quiet in comparison to a lot of stuff I've listened to, or even my own music on there - with the peak being around -5dB on the levels. 

&amp;#x200B;

My issue is that it's a very dense mix, with a punk rock vibe. Low end rumble taken out, all the high end that wasn't audible in the mix shelved off. I've done everything I can to make sure everything is audible, and I'm happy with how it's sounding, but it's just too quiet relative to everything else on the platform.

&amp;#x200B;

The only option I can see is to turn the limiter gain up, but that will compromise the mix which I'm happy with. 

&amp;#x200B;

What do I do?

EDIT: Thank you to everyone that chimed in, it's been a really useful learning experience!",t2_8c64t,125,0
Is there a free calculator for determining the subjective tone from 2 frequency waves?,"Link to what I'm talking about

http://hyperphysics.phy-astr.gsu.edu/hbase/Sound/subton.html#c1

Essentially, I want to be able to put in F1, F2, ..., Fn and phases as percents for each wave and get a list of subjective tones with beat and frequency information. I've tried Google, but could only find above resource.",t2_2gvq85vd,5,0
Which bass trap design should I choose if I am using 111kg/m3 rockwool?,"I'm doing an across-the-board acoustic treatment of my loft. I recently came into 20m2 (65 feet) of 10cm (4 inch) thick rockwool (from a cladding company that didn't need it any more and were selling it off cheap.) I'm sorted for ceiling cloud, reflection points, rear wall... I know what I'm doing with them.

The place I'm struggling to make a decision is with my corner bass trap design - particularly the floor to ceiling corners. I have enough rockwool to stack triangles in every corner - floor to ceiling - and build a frame and cover them with fabric, but this is obviously a lot more effort than just building panels and having the straddle the corner with an air-gap.

Now, the rockwool I have is pretty dense and heavy. I just weighed a 60cm x 120cm x 10cm panel, and it was 8kg. (2 feet x 4 feet x 4 inches = 17.6 pounds). An online calculator tells me that the density is therefore 111kg/m3.

What is the best thing to do in terms of my corner bass traps with dense rockwool like this?

&amp;#x200B;",t2_tobr72x,1,0
What are some pros and cons of audio engineering?,I have to start applying to college soon and need to make my decision. I have always been between audio engineering and aviation (pilot or ATC worker). Obviously this sub is going to side with audio engineering but I want your reasonings why you love and/or hate your job. ,t2_2axe2cla,1,0
News on Apogee Duet/Quartet updates?,"I own the Apogee One and it's been really great.

Recently, I've been eyeing the Apogee Quartet.

It seems like the perfect fit:
 - 4 combo inputs
 - 6 outputs (great for outboard gear)
 - Native control via Logic Pro
 - Nice design/footprint
 - Made in the US

...but:
- It was released in 2012
- It's a USB 2 interface
- It's ~$1,500

I was wondering if there are any rumblings about updates to the One/Duet/Quartet line?",t2_6w9ga,0,0
Is there anyone who mixes/masters stuff in the Hip Hop genre that could help me understand a few things/answer a few questions?,"Hey everyone, looking for someone to ask a few specific questions, nothing too technical or anything like that, just looking for advice on creating a sound that I like and that I’m comfortable with, thanks in advance!

When mixing and mastering, would you need more than just the vocal/beat mp3 files? As in would you need each sounds track separate? 

Is there a way to master vocal audio to match an mp3 file of a beat/song whose sound I like already? 

Seeing as some engineers are expensive or too expensive for me, what are some great steps to get started, assuming I have a very elementary understanding of music as a whole, but I have an immense passion for creating",t2_20wbu5xs,4,0
What bass amp size to record sick tones?,"So I have a massive live rig, but I honestly feel that it is a bit impractical for recording, so I'm looking at a fender rumble 40, it has a DI out, so I'm covered that way.  For recording purposes is a smaller amp or larger amp preferred?",t2_ifhtomx,3,0
Part 2! IKEA DIY Plate Reverb (it sounds good now!),"Hey audio engineers, I just posted part 2 of my DIY IKEA Plate Reverb hack series.  It's funny how a couple of small/cheap changes make a BIG improvement in the sound.  It's still cheap (less than $150 in total), but it actually sounds like a pretty decent sounding plate reverb now.  Anyway, hope you like it!

[https://youtu.be/5OcRMA2FNUE](https://youtu.be/5OcRMA2FNUE)",t2_t3fwi45,237,0
Confused about my fader readings and loudness,"I am mixing an album using Cubase 10 Pro.

&amp;#x200B;

Recently,  I have been getting a lot more into the nuts and bolts, specically DBFS, LUFS, and metering. The track in question has arrived to me from the studio quite quiet. After doing some mixing and balancing, I'm getting an integrated LUFS of -31. I noticed how quiet it was when I had to turn up my speakers to hear the rough bounce of the raw recording.

&amp;#x200B;

I am trying to get each track to peak at -18 on my fader's meter peak level. This is -18dbfs, which is a good target, right?

My my stereo out is peaking at around -12, yet my integrated LUFS is much lower.

So, a few questions.

&amp;#x200B;

&amp;#x200B;

1. Should I ever push the faders above 0? Is this an instance where I should?
2. When would I increase the gain in the channel settings instead of pushing the fader? What's the difference?
3. Does my mix have a lot of headroom? Does this mean that I can simply push the master fader when mastering to achieve a more standard LUFS?
4. What do I do with quiet tracks? in this particular song, there are brushes on the drums which need a bit of a boost. Currently I'm bringing the other tracks down to match, but this is resulting in a quiet mix overall.  How do you deal with quiet individual tracks that are too quiet for the mix?

Thanks",t2_kpmzi,1,0
How do I make spoken audio sound like a recording from the 80s?,I'm working on a video project that requires audio which mimics the audio quality used in 80s television.  How would I go about doing that?  I use Audition and have been unable to find any information on how to degrade the quality.,t2_32i3t,6,0
[Question] EQing Reverbs before or after it?,"What are the pros and cons to EQing reverb, going into it versus after it and what are examples of when you would do either? For guitar reverb, I put the pass filters on after the verb, but I just watched Pensado EQ into a verb on a vocal track. ",t2_cehms,5,0
"Home Recording: Analyzing Your Room's Acoustics to Get Flat vs. Making Your Room Sound ""Good"" To You","Plenty of us are home recording enthusiasts. It's a hobby we enjoy so much, that of coming home, layering many instruments together on a melody or progression we've been humming all day, getting that flow going and experimenting with new sounds. We want to create our lab, hand picking every piece of gear for a specific need and using it to death, learning everything we can.

The big part of research, is **how we get our room to sound**. Our monitors, of course, are affected by our room. Our recordings, whether they be vocals or some other acoustic instrument, are dependent on the acoustics of our room. But for most of us, that room is a bedroom, or an office, or some other space we need to be both liveable and aesthetically pleasing. 

Lately, **I've been identifying flutter echoes or high frequency build ups in my recordings,** find where the noise is coming from and slapping 2"" Rockwool or Fiberglass on it. I'm sure many have got to this step. 

Now I hear, ""hey the more high frequency reflections you eliminate, the more the low end ""modes"" will shine through. You should **get some Room Analysis Software** and Equipment to measure your room modes and rethink placement. Also, 4 inches is better than 2 inches.""

That's when I had my moment. **How far do I want to go?** Am I producer/recording artist? If so... **do I really need a ""perfect room""?** Or do **I just need to tame the flavor of my room**? Maybe I should pay other people to mix and master my music who already have the ""perfect"" sounding room. 

Anyway, that's the discussion I wanted to have. I think I'm just gonna slowly fix problems I identify in my process and fix them one by one. **And as far as having the perfect room, I'll leave that to the professionals.** ",t2_2osn9rfe,88,0
How does stereo width work?,"For context, say you have a stereo track and you adjust the pan pots to make a 45° angle. this will bring the stereo track more into the ""centre"" of the mix. Now say you adjust the pan pots so they now make a 110° angle. This has the effect of ""widening"" the stereo field, but I don't understand how this works. I've researched mid/side processing and understand that mid is the content that is identical in both speakers whereas side is the content that 'differs,' but how does this difference result in width? And how does something spread wider into the stereo field? I hope the question makes sense, thank you all :)",t2_61b1tn,18,0
building a studio in a rehearsal room,"hello everyone,

i have a band and we decided to renovate our rehearsal room. before we were sharing the room with 3 other bands but we kicked them out and brought on board some producers who are willing to make this a studio and rehearsal room with us. meaning only our band equipment, monitors, pa and computer + rack + desk will be in the room.

budget is low, why we won’t separate control room and studio or build a room in room construction. the idea is basically to record our band on multiple tracks while jamming or rehearsing and for the producers to have a somewhat nice sounding room while being able to record external musicians.

it’s a basement room of ca 50sqm with tapestry and plasterboard walls and ceiling.

since none of us has ever done this before, we don’t know what’s best for the room. has anyone experience with an opened control room like this? should we stick to the live end, dead end principle?

i‘m very excited about this and would be happy to hear what you guys think!",t2_ssnpa,3,0
