title,post,author,upvotes,is_ls
Mixing/producing varying amounts of guitars for indie-ish music?,"So my band is kind of post-rock influenced, if that helps. We're recording ourselves and for the most part we've had balanced guitar parts. We'll usually record two versions of each rhythm part..with different voicings, and hard pan them. And there's usually 2 lead-ish parts going on (but not really lead...more like just some arpeggios or little noodles here and there), which I've been panning less hard. So this way neither speaker is really fuller than the other, which..seems ideal? Is this the right way to go about this? And if there's one lead-ish part...should I still record the rhythm twice and hard pan it? I really like the trick of sending a reverb to the opposite speaker, so that helps some, but one part in particular of one of the songs feels weird and I was just hoping some people could share their thoughts/experiences and anything i should try or keep in mind. Is equal weight in each speaker really that important all the time? I know the stock answer is ""do what sounds good"", but sometimes I get too close to it and OVER analytical and can't really decide if things are ACTUALLY a problem or not.",t2_4alf1,2,0
Quick recording question: Waveforms and quantizing.,"Okay so say I have drummer Bob playing this AMAZING live track, but, during a part or two his kick drum or snare hit is 1/8th note off. IT's maddening listening to it because everything else sounds so perfect and good but this part. Or the same things happens with Jimmy's guitar solo: a couple notes are like 1/8th, 1/16th, 1/4th off, only a few of them are off the click track, but they are obvious.

I get quantizing with MIDI - you just drag around until the triggered audio lines up and sounds correctly. 

But, with these ""static"" audio tracks - I'm talking a complete recording from live musicians in audio waveforms, that aren't as easily editable: How is it done? Can someone step out the process for me? I see it like this:

Step 1) Cut the part that's off. 

Step 2) Now drag it to where it lines up on the grid. 

Step 3) Done! (Is it? Do I need to do anything else here? Like, now there's probably a gap or gaping hole in the audio waveform, which might skip or sound bad in the playback yes? So what to do?)

Someone else said you actually rarely cut and drag like this, but instead ""quantize"", like pressing a button. I know this is in pro tools, cubase, for MIDI, but is it also for waveforms? If you press that button doesn't it accidentally can possibly f^ck up some of the other notes track? Can you do it only on a single bar? ",t2_14dsl4,1,0
Make your voice sound exactly the same as your inner voice?,"We all know that feeling when you hear yourself on a recording, shocking. Add a bit of room reverb and youre getting closer to sounding like yourself, but what if you wanted your voice to sound exactly the way you hear it? When we talk our whole body resonates with our vocal chords, so maybe doubling the vox channel and EQing it to have the same frequency as the resonance that goes trough your body might make it sound more like you? You might even have to EQ the dry channel and add some lowend to match your inner voice. Any ideas how this might be done the best?",t2_26ffd8mo,65,0
Connectors for AT2035 Shock Mount,"Can they be purchased separately?

https://imgur.com/a/o5NjrUR/

I really don’t want to spend $75 on literally just a shock mount just because I lost a tiny metal piece.",t2_ps42t,4,0
Any good channels/websites to learn audio engineering basics?,,t2_8gto9it,139,0
What method do you guys use to get those classic disco string sounds?,Been listening to a lot of 80's disco and some modern disco house and IO was wondering what vst's or sample packs you guys use? ,t2_fe8ud,11,0
"[Question] How to go about removing/dampening ""cheers"" from crowds and amplifying vocals from an object nearer camera ?","Hey 

So what i wanna do is if not remove cheers from crowd at least dampen them down a lot so the vocals coming from the object near the camera can be amplified and made more hearable?

  
What programs do i got at my disposal? 

Adobe Premiere/after effects/Audition + Audacity.

&amp;#x200B;

Thanks!  
",t2_ee14m,0,0
"Friday - How did they do that? - October 19, 2018","Post links to audio examples that are apparently created by magic. 

Please post specific links in the timeline if applicable.

  Daily Threads:


* [Monday - Gear Recommendations Sticky Thread](http://www.reddit.com/r/audioengineering/search?q=title%3Arecommendation+author%3Aautomoderator&amp;restrict_sr=on&amp;sort=new&amp;t=all)
* [Monday - Tech Support and Troubleshooting Sticky Thread](http://www.reddit.com/r/audioengineering/search?q=title%3ASupport+author%3Aautomoderator&amp;restrict_sr=on&amp;sort=new&amp;t=all)
* [Tuesday - Tips &amp; Tricks](http://www.reddit.com/r/audioengineering/search?q=title%3A%22tuesdays%22+AND+%28author%3Aautomoderator+OR+author%3Ajaymz168%29&amp;restrict_sr=on&amp;sort=new&amp;t=all)
* [Friday - How did they do that?](http://www.reddit.com/r/audioengineering/search?q=title%3AFriday+author%3Aautomoderator&amp;restrict_sr=on&amp;sort=new&amp;t=all)

     Upvoting is a good way of keeping this thread active and on the front page for more than one day.
",t2_6l4z3,8,0
"How can I make beatbox recordings sound more ""punchy""?","This video ([https://www.youtube.com/watch?v=PItO1YQ89Hg](https://www.youtube.com/watch?v=PItO1YQ89Hg)) is a perfect example where you can ""feel"" the beatbox. Any advice on achieving this sound quality?",t2_2fvwcid6,1,0
What bit depth should i be exporting too?,"I record vocals and mix them myself over mp3s or wav files.

At what bit depth should I be exporting to? 

I just put my music on SoundCloud right now, but trying to get on Spotify, iTunes etc in the future.

Thanks all

Edit: thank you everyone who replied and answered my question. This community is awesome",t2_zdt90,33,0
Enhancing the audio quality,"Hi, I've recorded a call with my client which involves a hell of technical jargons yesterday. Unfortunately, in the recording, his voice is too feeble and my voice is loud and clear. Is it possible to enhance his part of conversation? 
Thanks in advance. . . ",t2_gle6218,2,0
Is there a calculable relationship between pitch and tempo when it comes to how the two change in relation to each other (like when a record lowers in pitch when it slows down)?," 

Say I have a track in some BPM, like 120. How do I figure out what the tempo will be if I shift it up or down by any amount of semitones?

Thanks.",t2_9ubaj,0,0
"Compression , saturation - loudness","Hello everyone , i want to permanently clarify something .

My aim for my mixes is somewhere -8 /-9 lufs (good for club play) 

To get there , i understood that i have to make a very balanced mix and a good mastering .

To reach a good loudness , i need COMPRESSION and SATURATION , right ?

Should i use compression and saturation on every track? 

The compression limits the peak of the sound and make it more liniar , right? 
The saturation increases the loudness without increasing the peak , right ? 

So , i should theoretically :

1.compress every track as long as it still sounds good .
2.saturate every track as long as it still sounds good. 

Extra: why should the kick be compressed ? It's a ""boom"" sound . It gets less punchier with compression . 
Should the sub bass (3xosc from fl studio) be compressed ? Or just saturated?

Please , make me understand these things . It's the only thing that stops me from getting my mixes done. 

I use FL STUDIO 

Thanks !",t2_26ckb8oi,0,0
Sound interface of DJ CONTROLLER,"Hello everyone , i have a question .

I want to mix and master music at the highest quality and precision. 

I have the ATH-m50x as headphones .
The problem (question) is that i use a Pioneer DDJ-sb2 as an audio interface . 

Is that ok? Will the quality be the same as an audio interface ? 

Is 24 bit/44.1 kHz enough for audio production ?",t2_26ckb8oi,0,0
Record studio quality vlog/game capture without background noise?,"Not sure if this is this the right sub.. I am trying to get studio quality sound when recording vlogs and game footage for YouTube. I have a blue yeti usb mic. I have seen many articles saying that it is a popular mic, however it works a bit too good. It captures everything, the humming from appliances, air, slight movements. Yet, I see people recording outside and inside and it sounds great. I can also tell that they are not only just editing dead space. Because you would still be able to here the noise once talking began again.

Is there a technique that I don’t know? I’ve also tried a Rode Lapel mic, I am still getting the same background noise. I would like to cancel this noise, much like a modern cell phone.

I notice gaming headsets with mics are able to cancel the background noise. I’m looking for a mic or setup that does that.

Thanks in advance!",t2_jyjyg,0,0
First Tracking Session,"Hello friends. 

So I am in search on some advice regarding tracking a full band session. I should preface with this:

First off, this will be my first time really “taking the board” and working with a band on a session. It should be said that I reached out to these dudes (one is a good friend), because I am trying to get better with the more technical side of music and recording music. We have all agreed that this will be a good growth opportunity for both parties and there won’t be any money exchanged and it will be a pretty casual day. 

That being said, I am trying to get some advice on things to watch out for and to be prepared for, as well as some pro tips on things like checking phase on drums, getting the best recordings possible with what I have to work with, and just silly avoidable mistakes that a rookie like me will probably still fall victim too. Any advice helps!

Also, as far as gear I will be running Logic Pro in my MacBook Pro and using a Zoom MRS 1608. I plan on mic’ing the room with my Bluebird condenser mic, using a SM 58 for vox, and the available drum and amp mics that they have to use. 

Thanks y’all! 

UPDATE:

Everything went great today, with a few hiccups here and there. Overall, it was a solid experience and I’m looking forward to doing some more work with this band. They were also happy with the way things went. 

Thanks again for the advice!",t2_ml5uf,2,0
Uhhhhh am I mixing wrong,"I've heard almost everyone talk about producing and THEN mixing and the way I interpret that is putting all your sounds in and then changing volumes and adding effects and all that.  I've been doing that as I produce (as in I put the effects in and change levels as soon as I put a new sound in) and I can't imagine doing it the other way.  Is that the better way than what I do, because if so, uhhhh I'm kinda screwed lol ",t2_ngzmb0k,0,0
confused about asio,"correct me im wrong, from what i understand, asio is a driver which allows the audio interface to communicate with the sound card directly, bypassing the os of your system. Am currently using roland UA-101. The question is how do you enable asio??? I have the UA-101 driver alrdy installed, and the description states that the driver supports ASIO, but how to use it???",t2_1jd5ankx,2,0
Drum overhead position confusion,"Okay so I've read about the importance of maintaining an equal distance from the snare with both mics so as to avoid phase issues with the snare. However I've also seen a lot of drum mic setups where the overheads are at an equal height over the kit, sort of symmetrical over the kick or the centre of the kit. 

I don't really see how you can have the mics at the same height and also the same distance from the snare. 

Are these just two different approaches that yield two different results?

Sorry if this seems like a stupid query, but I can't seem to find anyone talking about it.

Any advice or help you could offer would be much appreciated!",t2_759fe,5,0
What's Your top ten most important parts of mixing?,"For example, 1. Leveling, 2 eq, etc",t2_wzeat,13,0
How to deal with loud 808 impacts?,"My biggest problem I'm facing these days is dealing with loud impacts in mixing/mastering, specifically when it comes to limiting. Let's say you have a low 808 boom on the chorus to give impact. Everything up until that point sounds just right but after limiting the 808 is stressing out the limiter, ducking the rest of the instruments, creating some artifacts with all the extra GR. Ok so I turn down the 808 hit. Doesn't really have the the same impact it did before mixing. I could split the difference and just live with a little bit of distortion but I'd rather not. I could also turn down all of the other instruments/vocals to make room for that hit but it doesn't make sense to change 99.9% of the song just for that .1%. Any thoughts? ",t2_evw9h,11,0
Best electronic album (engineering/mixing),"I’ve been binging on some electronica and thought we could all share. Electronic music always have really interesting mixes.


Pretty lights - a color map of the sun. 

This album was recorded using only analog gear. If I remember correctly he recorded 8 (might have been more) full length LPs and then sampled those to create this one album. It’s beautiful. There’s moments I feel there’s too much compression on the cymbals or low end mud, but it grows on you. ",t2_p3exdbo,5,0
Rates for Ableton Live classes,"Hi all. I'm going to be offering one-on-one instruction in Ableton Live to a few friends soon as a way of picking up some extra cash, but I have no idea what is a fair rate to charge. I don't want to gouge my friends, but I want to be compensated fairly for my time, especially as I may have to travel to their houses. Does anyone here have any insight?",t2_1erlddj7,1,0
How do I know what a safe volume is for my PA Speakers?,"I'm using Electro-Voice EKX 15P. There's an input meter that shows me a percentage bar. It has an emergency limiter on it.

Then there's the master that goes from negativity infinity to +10dB. How do I make sure I'm not playing them too loudly where it will hurt the speakers (especially tweeters) long term if I do it for too long? ",no author,1,0
"Does it bother anyone else that The Beatles would pan the bass all the way to the right? And Kick drum, etc?",Why would they do this? Just wondering when obviously in today's world it's almost unheard of ,t2_mo62p,83,0
Whatever happened to Funk Logic's fake rack space fillers?,"Does anyone know what happened to this company? They used to make a fake rack space filler that had funny sayings on it. Not sure why they aren't around anymore as I think there would be an even bigger market for these types of things today. They would make a great gift and are also fun talking points for clients in your studio.

[Here's a picture of their Palindromter.](https://media.sweetwater.com/api/i/q-82__ha-09b5e2ead8ab8127__hmac-441967e7a3be47cf813de8de992acf8e7db0f9f9/images/items/750/3PIII-large.jpg)

I'm considering making an original one for myself with my own sayings on it.",t2_df3hz,111,0
Master clips on phone speakers but nowhere else?,"I'm almost completely done with my first album and I've listened to my masters pretty much everywhere. They sound great on different kinds of headphones, my monitors, my laptops speakers, and in a few different cars. The only thing is sometimes the high mids can be a bit harsh which I need to fix. But I just listened to the songs on my phones speakers and they're all awful. They all clip and distort heavily, and just as a reference I played music from Spotify and it sounded fine. How could my masters sound good on so many different devices but completely fail here?",t2_9mnl1,1,0
Changing Sampling rate during playback,Does it hurt your converters? I mean at least it sounds like shit for a few seconds,t2_10dium,0,0
Why there are different types of Compressors and how this is important for mixing,"I want to start a general discussion on the different types of compressors and their uses; The different ways you like to compress certain elements or to achieve specific results with a particular compressor in mind.

I only recently discovered that there are not only different makes/models of compressors, but that there are these completely different types (VCA, OPTO, VARI-MU, FET).

For the longest time I used Ableton Live's stock compressor, for *everything*. No wonder everything I did was shit. It feels good to learn.

Please share your favorites and for what you use them on!

Edit: Thank you everybody. I definitely learned some things. Questioning my own knowledge and presumptions about compression, trying to 're-learn' things even though its so tempting for me to believe I already understand everything enough. Cheers",t2_1inttfnp,149,0
Today I'm meeting colleagues to give them basic advice for improving their video setup. I want to give them a 1-page crash course in acoustic treatment. What do you think of this?,"[Here's my page of basic pointers](https://docs.google.com/document/d/1UfWjco96UKlltUhSYLZuZX4tOUU-L05zyyZhrbqsIJo/edit?usp=sharing) that I'm going to print a few copies of and hand out. Any feedback?

To elaborate, I'm meeting with a few people who know very little about audio production and treating a room for getting better sound. They currently record short video tips with talking heads wearing lav mics, plugged directly into the DSLR. I'm also going to go over the basics of running a boom mic through a mixer, which will eliminate garment rustle, get more natural sound, and work much better after treating the room, then talk a bit about editing audio to get good levels. This is just to help them improve or know where to research further. My advice will be free of charge, it's somewhat casual, half hour meeting.

I've been out of the audio game for a while so these points are from memory. Any major flaws in what I wrote?

Thanks!

Edit - [PDF link for those interested](https://drive.google.com/file/d/1nMwupuhEEc8fBPCFOsdJzV0HAogrmXE4/view?usp=sharing)",t2_9kgco,18,0
Logic Pro - Parallel processing Latency Issues Resolved (sort of),"Hi there, I wanted to share with you a discovery I found while doing parallel processing in Logic Pro 8. (which I have a suspicion may still apply to Logic 9 and X).

Problem was that one of the main group busses was lagged by about 50ms or so than the rest of my main busses. (every channel was sent to one of 5 main group busses: 1) Drums,2) Instruments pumped with a sidechain, 3) Instruments I wanted no pump, 4) Bass and 5) ""wobble"" fx buss. All were outputting to output 1-2, except for wobble buss and reverb buss, which were both routed back to the instrument buss with sidechain, and this routing is exactly what was causing the problem.

I was able to test this by sending a snare hit to the buss in question, while simultaneously sending to one of the other busses (also tested with main out), and you would hear it slap twice. I was fearing that perhaps new york compression and other parallel processing techniques might encounter issues in Logic pro with latency issues due to some architectural 'error'. However, with a little experimentation, I was able to alleviate the problem. **The short short summary is that it seems logic may have issues with multiple auxes outputting to eachother, rather than when they all output directly to output 1-2.** 

\*Aux1: Instruments were sent to this buss for processing with an LFO to perform a 'wobble' filter effect (Serum FX) ---&gt; only send was to Aux2 for reverb, and outputted to Aux3 (main instrumentation ""pump"" buss). Serum FX had a side-chain input activated.

\*Aux2: Waves RVerb ---&gt;outputted to Aux3 (main Instrument ""pump"" buss). 

\*Aux3: Main instrument Buss with SSL buss compressor (sidechained to a kick drum captured from aux 20).

Aux 3 was lagging by the 50 or so ms compared to the other aux/buss groups. Latency was set to ""all"" in logic pro settings so in theory, compensation should have been all in alignment. But check this out: when I removed Aux1's reverb send, the latency disappeared. Likewise, when I changed the output from the reverb buss (aux2) from Aux 3 to output 1-2, the latency would also go away.  I should note, when I would remove all plugins from the reverb aux, this had no effect on latency (if still outputting to aux 3). So we might conclude that there was something about two separate aux channels (wobble buss and reverb buss) feeding into a common 3rd aux creating delay compensation issues with that particular aux channel. 

But theres more to the story: If I removed the sidechain from Serum FX on Aux1, the latency disappeared. it didn't matter what was going on with the reverb aux. So I thought maybe this was all due to a flaw with Serum. I removed Serum, added an ssl compressor to the same aux channel (aux1). Latency still gone, but then I added a sidechain to the compressor and guess what? latency back, and I could perform the same experiment above with the reverb channel. So there was something about having a sidechained aux and its send ultimately meeting at a final common aux that will cause it to experience faulty delay compensation. Remove either the Sidechain OR change the send routing, and the problem goes away. Weird right? Anyone want to chime in on what might be happening here? 

Interestingly, I have not been able to recreate this experiment all the time, it seems to happen at random. If I were to take a stab at what's going on here, I think it has something to do with how the busses/auxes are routed internally with logic when they are established initially, and how it relates to the delay compensation algorithm. Perhaps it depends on the order of when they are established, routed to eachother, or when the plugins are added...the list could go on and on. So I would suggest being aware that these problems may happen in Logic when auxes are being sent to other auxes and there is some sidechaning going on. Not a common issue or scenario I'm sure, but still something to bear in mind. 

Hopefully this wasn't too convoluted, but I invite you to repeat the experiment and see if you can come up with anything. ",t2_1qnf0se9,1,0
I can't hear the difference when mixing,"So I'm trying to mix some music I've been working on. I'm a musician, and I can say with confidence that I have pretty ""good"" musical ears. But man, I just don't hear most mixing stuff. For example, adding a bit of compression, or using different compressors with the same settings, adding a tiny bit of EQ, I just don't hear the difference. Of course if I compress something really hard or if I cut a lot of a freq. I hear a difference, but the small things I don't. For example, I bought some Waves plugins and everybody praises this J37 Tape Saturation, I just don't hear it doing anything haha.

Do you guys have any tips or ways to improve this?",t2_uh6is,5,0
Open circuit fault,"I’m working with an IP controlled amplifier made by QSC. Periodically I get an open circuit notification for one of the output audio channels. After a minute the notification goes away.

When this happens I still have audio on those speakers, and when I check the wiring on the amplifier it looks fine. I have not checked the speakers yet, will need a ladder to investigate. But what are your ideas why I would get an open circuit fault and still have audio?

UPDATE: Thanks for the ideas everyone. So far I have not been able to look further into the issue. But I have gone back to look at the amp a few times and the fault is no longer appearing. When it was showing up it would flash red, showing a fault, and then go away after 30 seconds. I will update when I get time to go back and look further at the amp, hopefully with some interesting information.
",t2_sofev,0,0
When did sound recording 'come of age'?,"Bit of a weird question; I'm hoping someone will be able to help! Apologies in advance if this is the wrong place to post.

It seems to me that audio recording took a huge leap forward in the 1960s. A great example of this would be The Beatles' output: 1963's *Please Please Me* sounds ancient, but move forward just five years to, say, *Sgt Pepper* and, to my ears, the recordings could almost have been made yesterday (in a pinch). Some recordings also seem to sound 'older' than some records which predate them. *Waterloo Sunset* by The Kinks and *A Whiter Shade of Pale* by Procol Harum sound particularly old to me, but were recording relatively late (1967 I think).

Anyway, apologies for the waffle, but what is it that distinguishes these 'old' sounding records from the ones which sound newer? Was there a significant advance in microphone technology or tape in this time? Was it just down to the mix or how the records were engineered? Thanks in advance!",t2_1zhryofh,79,0
Models for recording/mixing sessions log sheets,"Hello there fellow audio enginners,

Anyone know where I can find good templates for recording or mixing sessions log sheets? Or what info should be included on one of these sheets? 

Thank you very much",t2_1djgj0lv,1,0
Will putting a high pass filter on my mic or recorder result in better quality than just doing it in post production?,,t2_k0u99,2,0
Sound engineer Geoff Emerick remembers recording The Beatles Sgt Pepper’s album,https://www.youtube.com/watch?v=D5caf6mAACA,t2_yk18c,171,0
