title,post,author,upvotes,is_ls
Sound Canceling Speaker,"Hey guys,

&amp;#x200B;

Not sure if this is the right subreddit for this, please direct me if you think of somewhere better to ask this.  


I've had this idea in my head for probably 10 years. I want a speaker that can produce high quality sound but only to the intended recipient. For example, I am sitting at my desk at work and want to listen to music. I want to hear it, but I don't want to disrupt the rest of the office. I also don't want to wear headphones in case I need to hear something around me.

&amp;#x200B;

[This image](https://imgur.com/DvV2jNV) is my idea. A small speaker that has 2 speakers. Speaker 'A' is sending out the music you are listening to, and Speaker 'B' is sending out frequencies that are 180 degrees out of phase from the music that would somehow ""collide"" with music 'A' at a set disctance so that outside the radius the music is dead.

&amp;#x200B;

I am FAR from an audio engineer... this is about the extent of what I understand... maybe there already is a product out there like this... if there is, please show me!

&amp;#x200B;",t2_yi5u1,1,0
Do pocket sized vocal E.Q.’s exist?,"I’m an A.V Technician and some times I get thrown on low budget events that use poor quality in-house speakers, for my own sanity, is there a small, 6-10 band EQ I can carry around in my kit? Weight is very important, Iv seen guitar pedal EQ’s, would that maybe work? 

Any help is appreciated, or vent your similar frustrations/solutions. Thanks!",t2_pia2y2e,1,0
Quiet Monitor,"I'm setting up a sound system for a choir performance.  We typically use only the 2 main output speakers (this is a permanently installed system in a school gym) but I would like to hook up a monitor speaker to place in front of the choir.  Right now I'm using the monitor out jack on the mixer (Yamaha 512SC FWIW) and I can BARELY get any volume out of the monitor.  I have to have the input line CRANKED to hear anything from the monitor, and then even on the lowest snip of volume, the main speakers are too loud.  Why is my monitor so quiet? Help!  Thanks!",t2_aukpz,5,0
Room/SPL measurement help,"Hi all,

I am a HiFi enthusiast, and would appreciate your help. I have set up an alright near-field music setup with Genelec G3, Benchmark DAC2 HGC and plenty of acoustic treatment (Konto panels and DIY bass traps). However, I don't have a way to take objective measurements of sound levels and room response. I want to make sure I don't damage my ears with too loud music and want to also get objective data on my room's response.

I am located in Finland, so Thomann's selection is available for me. Budget target is around 100€, but I can stretch to 200€ if it is necessary 

I don't have any microphone or mic preamp. I need to get the signal from the mic to my PC, so and USB mic or mic/usb-preamp combo would be the way (I think).

I won't be using the microphone for other purposes than measurement. From what I know, I think the mic should have a flat response and an omnidirectional pattern.

1) Is there a microphone that would do both: reliable SPL and room response measurement? Or would it be better to purchase separate devices?

2) Depending on the answer to question 1, do you have recommendations for the devices? 


Thanks in advance!



",t2_187heeso,1,0
"When do you pick plate vs hall, etc?","I'd think this would be a common topic but I just searched up plate on the subreddit and didn't see a bunch of posts about this topic.

I have been using Soundtoys Little Plate recently as a send with decay at minimum (500 Ms)lady anding Si Q to boost the send highs by 15 dB (Little Plate is extremely dark). Most sounds get 5-10% wet.

I'm pretty happy with what I'm getting with Little Plate. I'm also renting to own Toraverb but I have a hard time figuring out which would be best. The two are completely different (plate vs computational) but the difference isn't as apparent as the difference between any other effects I use (chorus, EQ, flanger, phaser, distortion, etc).

Are there situations in which you would instantly realize you need a hall instead of a chamber, plate instead of hall, etc? Or when you would decide you need multiple?

I like the sound of dry stuff and plates seem more forgiving because I can get low decay times (this I why I don't currently use chamber for example). Little plate is snappy enough on drums but I don't find myself wanting to use something less snappy on a vocal for example. Even on a pad which is AFAIK the most naturally reverby sound. Would you naturally increase the decay time you use for a pad or other non transient sound using a second send? 

Edit- thanks for the responses everyone. Not ignoring them, I'm going to go through them when I can make a more thorough reply",no author,125,0
[Question] Mixing Equipment Headphones vs. Monitors,"I am a student at a career school for audio engineering and production, I have access to the studio to work on projects, record, mix and edit, etc. Recently lost my studio monitors in a fire in my old apartment and someone recommended getting headphones and using software like Reference 4 Sound Calibration from Sonar Works to emulate the conditions of the studio while not blasting noise at my new apartment. What are your experiences with headphone vs monitor mixing and switching between the two? ",t2_jl4ei,3,0
App based audio distribution Solution,"I've used Pandora's business solution in the past with good luck. 

Now I am needing an app which allows for various stations such as from Pandora or Spotify which can be routed to various speaker zones. 

Cloudcover is another but they seem to be similar to Pandora for business.

Any recommendations?",t2_1i2l9ggn,1,0
"A little early, but what's on your Christmas list this year?",,t2_q8b0u,2,0
Do the daws compensate both input and output latency in the recording?,"I think it only compensates input latency and not the output, is this true?  
Edit: I mostly asking for Cubase and Pro Tools",t2_15wtsh,1,0
My Guitar Tracks Sound Like Garbage,"Hey everyone,

&amp;#x200B;

I recently started getting into home recording mostly just to record my own ideas and try to get a decent mix in the end that I can show my buddies or put on youtube.  The issue is that everything I record kind of sounds like garbage.... Its just full of low end and lacks brightness and that chimey tone. The thing that bothers me the most is when I watch a Youtube clip of someone demoing the same amp / sim / IR's as me it sounds totally different and this is with no EQ or Compression etc... Even the DI tracks they record just sound better but I can only imagine this is a hardware issue on my end.

&amp;#x200B;

My equipment is a Steinberg UR22 for an interface and I use Studio One as my DAW. I either plug my guitar into my 6505 tube head which is plugged into my Two-Notes Torpedo live into channel 2 of the UR22 or I try and just go straight into the channel 2 with the instrument level button pushed on and use either Helix Native, Bias Amp, S-gear 2 etc with quality IR's ( Ownhammer or Celestion ). My guitar is a Ibanez JBM100 I think? Its the cheaper Jake Bowen signature guitar.

&amp;#x200B;

Is my UR22 not cutting it for this application? Am I overloading the pre? ( I do see some clipping and the gain is at the lowest ). Is there something I can do to fix that?  If I was to buy a different interface what would you recommend? I am really looking at doing almost anything at this point and I feel like I have good hardware maybe minus the UR22 since its low end",t2_f6ym47s,1,0
Mixing process for super dynamic vocals,"I have a singer (me) who has parts that are super intimate, right against the mic breathy stuff, with spurts of yell/singing and belting...sometimes mid-line and sometimes just separate parts (but mostly separate parts). How do you approach mixing things like this? I would think using the same compressor settings would be really weird (either not catching the quiet parts or crushing the hell out of the loud parts). I've been just turning the quiet parts up quite a bit to almost match the loud parts, pre-fx...but just curious what the proper way to do it is. I'm not a professional.

  
Thanks!",t2_4alf1,68,0
Strange mixdown,"My mix compared to commercial tracks are louder, more open, punchier. The ref tracks i listen to have a nicer, even, lower perceived volume but still hits at 9 LUFS. 

I cant figure out why. If i slap on a compressor on the master it just sounds squashed. If i do it mildly, my track still hits too hard. My gain staging is good. My tracks are mixed nice and properly. 

Should i apply harder compression in the individual tracks? Or is it some other mixing modjo i am missing?  ",t2_5i2pk,0,0
Issues with instrumental and vocal matchup,Trying to record a track but the quality of the instrumental is just so much better than my vocals. Got a 50$ microphone and it's so one sided not sure if it's the mic quality or software they used for the beat or both. Considering recording with the music playing in the background but figure that would make it more difficult to cut out the heavy breaths and other noises would that be the best option in this situation? ,t2_rkyot,1,0
chorus on bass?,"I recently watched a vid about Andy Wallace's mixing traits. One thing that interested me is he often uses chorus on bass to give it movement and some spread.

Any thoughts on this? I've only ever left bass mono. But his mixes are pretty intense, imho.",t2_msh7rvr,16,0
Do any of you have expertise in acoustic modeling?,I have a computer science background but my passion is in audio and I have lots of experience in data analytics/simulation. I was just listening to a guy talking about how his company uses acoustic simulation to make better speakers. Do you guys know about acoustic modeling? Thinking about emailing a bunch of audio companies and seeing if they are interested in hiring for this kind of work. Mic/monitor/etc companies.,no author,1,0
MS Mics on Drums,"Hey Guys,

&amp;#x200B;

I'm recording a psychedelic/stoner rock band on saturday starting with the drums. I'd like to play around with MS micing.

&amp;#x200B;

Any good tips on placement? Also grateful for any mixing advice...

I've looked on youtube for videos about the subject but couldn't find anything very helpful...

&amp;#x200B;

Thanks in advance

Matt

&amp;#x200B;",t2_e33qz,1,0
Load box for IR's question...,"Starting to jump in to the world of IR's...I'm scared. Always mic'd up amps but to more I read and see, I'm coming round to the convenience for sure. 

I bought a Bugera PS1 hoping to kill two bids with one stone, firstly to be able to use my amp at low volumes and secondly to use it as a load box and try this IR business. 

Well either my amp doesn't wanna play ball or the PS1 is not that great as an attenuator...it sounded TERRIBLE very fizzy, made me hate my amp (Cornell 20w Plexi). I tried using it as a load box but didn't really get anywhere, I think the attenuator was still getting in the way as the manual says when using the power soak you will instantly be hearing your amp at 50% so basically I was trying to get a signal into Logic in with an IR on half the sound/volume my amp should be pushing out. 

So now I'm looking at dedicated load boxes, maybe something like the Suhr Reactive Loadbox which I believe will just send the same amp signal through to my interface. But here is my question...

Since I have a Plexi style amp, theres no master volume so to get my overdrive I need to crank my amp (hence my attenuator experiment at the beginning)...so if I was to use a dedicated LB, where will I essentially be able to get my extra gain? Bringing Master faders in Logic down while turning the amp up? 

Apologies if this is such a straight forward thing, I've just done so much research and YouTube'ing I'm not really making any sense of it anymore. 

To summarise in caveman speech...

I want to record guitar. 

I have loud amp.

How do I record loud amp in apartment?

Thanks in advance :-)",t2_f0w1kte,1,0
Drum Micing Techniques,"Hey all. My band will be recording two songs this week. The session will take place at my university where we have access to thousands of dollars worth of gear. Mic limitations are not an issue.

My question is does anyonw recommend any good drum micing techniques. I'm looking to get a nice and full sound of the drums. I've noticed in the past when I've mices drums the cymbals seem to be too upfront &amp; hard to manage in the mix.

We'll also be recording guitar, bass, and vocals. If any has any good recommendations or advise for tracking those I'm open to that as well.

Edit: tones of wonderful advice/recommendations. Thank you all I appreciate all the input. ",t2_t9xnq,40,0
How much track shifting do you do to correct phase when using multiple mics? Especially for drums,,t2_1fywp7z4,9,0
"Focusrite Clarett Preamp ""Air"" Transfer Function","[https://imgur.com/a/a3FnNBi](https://imgur.com/a/a3FnNBi)

Frequency response curve of the Clarett ""Air"" feature, designed to model the Focusrite ISA preamps. Tested using a Clarett 4pre. Reference Channel is through input 2, with the tested signal through input 1. Green line is with ""Air"" turned off and red line is with ""Air"" turned on. Looks like you get about a +2dB boost at 1kHz, rising up to about +4dB at 20kHz.

&amp;#x200B;",t2_kmzbfi,100,0
How loud do you tend mix audio in the studio?,I’m someone who tends to mix at lower levels and turn it up to balance the mix at louder levels but I’ve recently been in the studio with someone who likes to mix at louder levels more often,t2_x1wmm,1,0
audio levels,"when recording in fl studio 20 how do you make it so that all your audio comes out level, meaning even if you begin to get loud during recording, your vocals don't stick out in the audio, getting louder randomly. is there a way to have it so that all your audio is kept at a certain loudness or is it easier to set a limit on how loud your vocals get if you were to start getting too loud so your voice doesn't stick out in certain parts of recording.",t2_19jhf6lg,1,0
Options for routing audio on a Mac?,"On a mac, is there a way to map the DAW return from one audio interface to the audio output of a second audio interface without using a DAW? I have my keyboard's audio out plugged into a Presonus Firestudio which is under my desk and I'm using a Focusrite Scarlett 2i4 on my desktop for the audio out to my speakers. I created an aggregate device and it's easy to achieve the mapping in a DAW but I was wondering if there were other options. I tried Looped from Rogue Amoeba but it increased the latency too much. 

&amp;#x200B;

Thanks.",t2_7aobx,1,0
"Ethan Winer on the ProSoundWeb ""Signal To Noise"" Podcast","[Link](https://www.prosoundweb.com/types/resources/podcast/new-signal-to-noise-podcast-talking-with-ethan-winer-a-k-a-the-audio-expert/)

Ethan talks about his new Null Tester device that definitively proves whether or not certain cables sound better than others.",t2_1plyg5jc,27,0
Is it possible to have too much dampening?,"My 'studio' is in a god awful room, not for echos but it's a really weird shape (kinda like a big donut with sloping sides, hard to describe) and there isn't a chance that I'll get it treated properly.

Is it possible that I could add too many 'dampeners' (foam, other soft stuff)? I know bass traps are very important but I don't really have the money to buy some so any other alternatives would be nice. ",t2_16dn6l,1,0
"Tips &amp; Tricks Tuesdays - November 06, 2018","Welcome to the weekly tips and tricks post. Offer your own or ask.  

For example; How do you get a great sound for vocals? or guitars?  What maintenance do you do on a regular basis to keep your gear in shape?  What is the most successful thing you've done to get clients in the door?

  Daily Threads:


* [Monday - Gear Recommendations Sticky Thread](http://www.reddit.com/r/audioengineering/search?q=title%3Arecommendation+author%3Aautomoderator&amp;restrict_sr=on&amp;sort=new&amp;t=all)
* [Monday - Tech Support and Troubleshooting Sticky Thread](http://www.reddit.com/r/audioengineering/search?q=title%3ASupport+author%3Aautomoderator&amp;restrict_sr=on&amp;sort=new&amp;t=all)
* [Tuesday - Tips &amp; Tricks](http://www.reddit.com/r/audioengineering/search?q=title%3A%22tuesdays%22+AND+%28author%3Aautomoderator+OR+author%3Ajaymz168%29&amp;restrict_sr=on&amp;sort=new&amp;t=all)
* [Friday - How did they do that?](http://www.reddit.com/r/audioengineering/search?q=title%3AFriday+author%3Aautomoderator&amp;restrict_sr=on&amp;sort=new&amp;t=all)


     Upvoting is a good way of keeping this thread active and on the front page for more than one day.
",t2_6l4z3,1,0
Why get a power conditioner?,"I own a Furman M-8Dx for my studio. I get asked by a lot of visitors why it’s better than a surge protector you can get at any store. 
To me, it provides more peace of mind than the tripping hazard I plug my Xbox into. 
Ultimately I don’t have the technical knowledge of why it’s better or safer for gear. I just know (or think) that it is, by miles. 
Can anyone explain in simple terminology?

EDIT: I just read [this](https://www.ecmweb.com/content/surge-strips-vs-plug-power-conditioners) 

TLDR: Surge protectors reduce but don’t eliminate harmful surges. Power conditioners have more thorough hardware made to reduce and usually eliminate it.
Also says surge protectors create noise to ground voltage while conditioners eliminate it.",t2_1649ec,14,0
Stereo imaging in reference to mixing,"X POST FROM r/trapproduction

I’ve been producing for about 3 years now pretty heavily. I believe im getting my mixes pretty well at this point. But I realized after reading another thread I very rarely focus on stereo imaging while working on a mix. I’m looking for tips specifically for hip hop but any genre will help. Just a few questions 

1. I’ve been told you can clear a lot of space in a mix with panning certain instruments and such. How should I go about doing this? What instruments should this apply to or in what situations can this be done.

2. I don’t have a very keen ear to stereo imaging and what a bad image is compared to a good one. If anyone could provide examples that would be great. 

3. How should I know when and when not to widen or shrink something on a stereo field. 

4. Any tips possible you guys can give. Shoot em.

Thank you all for responses to come!",t2_uf7hn,2,0
"Anyone here have any luck using an SM7b on a snare drum? If so, where / how was it placed?","I’ve got a little recording project coming up here in the next few weeks and I’m curious to try new mics and positions on the snare of a drum kit. I’ve used SM57s in the past, but I just got my hands on an SM7b and I’m wondering if it’s worth my while to try it. Any info helps!",t2_1gadk3c5,2,0
Are there any valuable resources for finding audio work in Australia?,,t2_917xc,2,0
Crosstalk in my patchbay is driving me crazy,"So I recently bought a Behringer patchbay, definitely not top of the line but I thought it would get the job done.

The channels are numbered, and the rows are row A and B.

If I have a signal going to the back of the patchbay, lets say input A1, I can faintly hear it in both A2 and B2.  I can faintly hear a signal going to one channel in the channel next to it.

This is driving me insane. What is going on? Is this a faulty unit? I know I didn't spend a lot on this, but this issue seems absolutely ridiculous to me.  I don't want to spend a lot on some switchcraft patchbay for what seems like very simple functionality.

==


**Edit:**  I did call Behringer and they are going to send me another unit.  They said that they don't really have any previous cases where customers had the issue I am having, so hopefully I just got a lemon and the new one will work.
    
I'm still interested in anyone that has had a similar issue or might have a technical explanation as to why this is happening, however.",t2_4anq6,2,0
Best Free File Sharing?,Does anyone have a recommendation for file sharing recordings with band members? I have DropBox premium but others I work with do not and I want to know what others use to push out lots of files without a subscription service. Thanks in advance. ,t2_l9593xe,7,0
Thoughts on metalcore production?,"Other than a few albums by August Burns Red or Katatonia  (and they hardly fall under the ""core"" label), most albums in the genre don't *sound* spectacular. There's no depth, no substance, no *balls*, nothing that makes me foam over their studio gear. Older recordings, like ""Back In Black"" or the ""Cheers"" theme have something magical about them, you all know what I mean, and that should be easy to carry over to metal, but no one seems to be doing that.

I'm thinking years of low budgets and lo-fi recordings have done something to the culture just like what happened to punk and black metal way back when, but ""American Idiot"" by Green Day and ""Everyone, Everything, Everything Ends"" by Shining suggest even the most dedicated DIY scenes can value quality. And I'm just not hearing that from core bands.

My band just started pre-production on our second album.  Our producer's into all the big core acts and as I hear their records, as I watch him quantize/pitch adjust all the guitar and vocal parts and layer them with some digital misinterpretation of ADT, as I hear people go ""huh?"" at the word Neve, I fear we're not gonna be challenging ourselves to get something spectacular.",t2_wobc5,4,0
Comparing insulation types for Bass Traps,"Who here has built there own absorber panels and/or bass traps? I'm working on some DIY acoustic treatment; looking at Roxul to make my absorbers. However the denim stuff is marketed as having ""superior"" soundproofing properties. Obviously soundproofing and acoustic treatment are not the same thing, but I'm still curious to see if anyone has compared the two, especially for corner bass traps.

&amp;#x200B;

For those who have purchased commercial absorbers / bass traps, how are they constructed? I know most use fiberglass (gross) but it would interesting to see the differences between panels and how the construction affects performance.

&amp;#x200B;

My current plan for wall panels is to make a frame out of 1x4s, put a 2"" thick piece of mineral wool in there, and leave a 2"" air gap in the back. For corner traps, I thought of either A.) having a sheet of mineral wool in the front, and denim to fill in the space behind, or B.) getting both 24"" and 16"" wide panels and making a double-layer corner trap with an air gap in the middle.

&amp;#x200B;

EDIT- I'm also curios if anyone has experience building / using diffsorbers? I've heard of putting a sheet of pegboard in front of an insulation panel to make a diffsorber. What about a pallet with rockwool shoved in there? It would be easy to mount- just set it on the floor and lean it against the wall.",t2_69zi9,5,0
"I'm an assistant engineer at a recording studio. Am I an employee, or an independent contractor?","I've been working at a studio in NYC for a little over a year, and my understanding is that I'm an independent contractor. However, now that I'm learning the difference between that and an employee I'm starting to think I'm misclassified.

While I do take sessions as an engineer every so often, the bulk of my hours are as an assistant. I have little control over these hours, and I'm basically on call 24/7. While I wasn't trained by the studio on anything engineering-related, all of my assistant-only duties had to be instructed to me, such as taking payment from a client. I don't have my own established business and I never signed any sort of contract. I never negotiated my rate; I just accepted the rate that they gave me. It really seems like I should be considered an employee.

I haven't had to pay taxes yet, but I know it's going to be a pretty big hit when the time comes as I'm not exactly making bank here.

This is my only experience working at a recording studio, so I don't have any knowledge of how other studios operate, in pretty much every sense. How do most other studios compensate their assistants, and how are they classified?",t2_6muii,122,0
Philosophy on multiple vocal tracks,"Hi, I am struggling to decide when I should leave vocals as a single track or when I should add additional vocal tracks- And if I do add multiple vocal tracks, should they mirror the main track, should they be an octave higher, or should they harmonize in another way?

I am aware that at the end of the day, the advice is always ""it's right if it sounds good"" but I was wondering if folks have personal opinions on how you approach this question, or if there are good online discussions on this topic.

I guess a related question is ""How many of the vocals that I hear on the radio that sound like a single track actually have additional sound incorporated from additional takes?""",t2_1r3g,8,0
Digital guitar dive bomb?,Using logic. Any advice on how do create a dive bomb-esque effect on guitar? Or just a rapid drop in pitch? The guitar I'm currently using doesn't have a tremolo. Plus I kinda want that digital sound. Thanks.,t2_avrtd,2,0
