post_lm,is_ls
bnc panel mount problem i did a portable wireless rack of  senny g3 a while back complete with antenna splitter and used these   fullcompass com/prod/050767 neutrik nbb75dfi bnc bulkhead jack  ohm d shape isolated silver in an effort to simplify the package turn out the antenna are basically impossible to turn without breaking them while they are attached in fact they are broken are these not the right panel mount using the standard g3 antenna which granted are fragile but still are able to turn fairly well when connected directly to the receiver any thought,1
theatre wish list suggestion i work in a medium/small sized theatre where we do concert musical stage play dance conference you name it i feel like i've got a lot of what i already want a full mic package mostly mid grade shure  monitor qsc k10 my house system is adequate danley main with qsc kw181 i am looking to upgrade my ls9 to an sd9 this coming year let's theorize you have a decent budget every year in the ballpark of   for whatever you want what would you upgrade or equip the space with,1
where to hire a qlab rig in the uk hi all doe anyone know of any hire company that specialize in qlab playback rig both audio and video particularly redundant rig thanks,1
what doe everyone do with broken/damaged gear i work in a venue that rent all of it equipment cable speaker stand snake etc amidst all of the rented gear is a bunch of old stuff that ha either been left by previous engineer or forgetful band im currently going through our inventory and wondering what i a relatively inexperienced audiophile can do with it it's mostly  and xlr cable but there are snake with channel that don't function microphone that don't work and old compressor and fx unit that don't get any love since i'm running a digital board i'd like to repair some of it but don't know if it's worth the time or money some of the stuff i can take to a local shop that keep it gear under warranty and replace it mostly i'm wondering what everyone else here doe with their damaged gear do you repair sell or forget about it i'm willing to learn how to fix these thing and i can't be the only one with random gear taking up my sound closet lol,1
 printing audio accessory so i bought a  printer for the purpose of printing little bit and piece for work check it out the pelican label is printed with pla and the dual clip is printed with ab still playing with setting and layer height and speed but i'm slowly getting there any other idea on thing to print   redd it/dquqgsxyzt421 jpg   redd it/2i70pd0zzt421 jpg   redd it/9ct3nqxyzt421 jpg,1
'39 cover queen,1
between the line  the real world hello all today's post come to you from a  seat concert hall in upstate ny the hall wa originally constructed for acoustic performance and a such is far more reverberant than we'd like for reinforced music the seating is covered by what some of my system tech buddy jokingly call a dash array that is a 'line array' that's too short to exhibit any meaningful line source behavior at any frequency specifically four box per side which is barely enough to cover the seating area what's more they're all driven off a single dsp channel per side so optimization option are few since this is the type of situation that we are very likely to encounter often in the real world i thought it might be illustrative to show what should be done in this situation v what can be done here   com/lnmdewq we see the house left array response over the seating area with mic position at the onax of each box in the array here is an alternate view   com/uddmc3h of the same data with  oct smoothing thicker trace and the coherence trace visible for position onax a top box back row the subwoofer is muted a lot of working with an analyzer is displaying the data in a format that's comfortable for you to parse and understand i tend to prefer le smoothing and thin trace but when writing or presenting i use more smoothing and thicker trace just to make the trend a little easier to see for people who may not spend all day staring at analyzer edit this comment   reddit  about using trace averaging is very important here i'm not looking for trend i'm looking to see the difference over the space trace averaging would completely hide the issue that is the basis of work in this post it's a video solution to an audio problem i don't want to make the trace look better otherwise i'd use photoshop i want to solve the problem that make them look that way the pink trace onax a is below the level of the others from  on up and much lower above  or so this coupled with the relatively low coherence from being that far back in a reflective room translates to poor intelligibility for the folk in the furthest seat who need it most what are the textbook solution solution  more box this is out at least without a lot of budget and advanced notice it's a permanent install and the rigging is a deadhang so we can't easily bring the array in we'd need to bring in motor and a rigger solution  close up the angle between the top few box besides the same logistical issue can't bring the array down can't pull pin out from a lift with the array hanging we're out of coverage angle the bottom two box are already at maximum splay so by closing up the top we'll be creating a coverage issue at the bottom perhaps this is preferable because front fill could be added but they can't stay on the deck so for most event they won't be added because people are lazy and so we still haven't solved the problem a an added bonus this particular model of box ha particularly course option for splay angle and the next choice is too narrow for this application solution  dsp tweak the gain and hf shelf on the top box except we can't because we're all on one channel here or can we these active box have a pot on the back that set the input level to the internal amp we can tweak that to get some gain back there's also a per box option for hf compensation and we can try our luck with that to see if we can get an hf shelf boost out of it a soon a we talk about level shading array audio people get really nervous the first issue is that once the array is level shaded some box are going to go into limiting before others whether or not this is a problem is heavily dependent on the situation typical shading situation involve bringing the bottom few box down by a few db to reduce the extra hf down front we try to do a much a we can with splay but generally we still will need a few db via gain and this isn't really an issue of limiting because these box in being turned down now have more headroom than those pointing at foh so there's no problem it's when the higher gain box are further back in the house like this example that we need to be more careful by setting the gain higher on the top box than for the rest we have a situation where the top box will hit it limter first and the foh engineer down in the middle of the house won't hear it if this is a high spl situation rap rock edm etc where the pa is taken to it limit every night giggity this is probably something we want to avoid however this is a situation that prioritizes low variance and high intelligibility and the pa is not operated anywhere even close to it limit for the type of event staged in this hall people would be lodging loudness complaint it's lot of old people okay far before the pa hit it maximum output so the dynamic range issue isn't a concern whereas creating a low variance high intelligibility environment for the patron is definitely a priority for the venue's management the other more common and far more baseless objection to array shading is that any gain offset between box break the line bob mccarthy ha written what i consider to be a landmark article   prosoundweb com/channels/study_hall/breaking_the_line/ about this which outline a number of reason why this concern is unfounded but i'll address the most commonly stated objection here that shading down some box reduces the array's headroom of course this is true but in reality the loss is so tiny that it's negligible in all but the most extreme situation we're talking of course about lf because that's where the box have the most overlap and thus the most summation we have a  box array which mean that the lf headroom of the array is  db above that of a single box that is  db  db  db  db which everyone know is  db no here's the same math in linear for for box at unity      get back to log with    db now let's say we turned one box down by  db how much lf coupling do we lose  db is about  in linear you've got these memorized right   is/1tqiicg so we now have  db  db  db  db which in linear is        that come out to   db rather than      or use    to get the db loss in relative term a compared to the no shading situation in a situation that demand low variance a half a db in lf headroom is a small price to pay for reducing front back variance by  db for the same reason i'm not concerned about goosing the top box by a db or two also for the same reason bringing up the gain on the top box or down on the rest if you like isn't going to cause a significant effect at lf where all the box are working together it will however help increasingly above  which is where our problem is with one pot notch whatever that is of gain and the hf coupling compensation onboard dsp filter engaged here's what we get   com/ebkq5qd   com/ebkq5qd if you compare that to the first image   com/lnmdewq you can see that we actually overshot a bit the back seat are leading the rest of the array in the hf by about  db above  khz given those two option i certainly choose the latter the intelligibility in the rear is greatly improved over the original state in addition i'll take an extra db or two in the back simply because of the stage sound down front what we have here is a pa that doe not get louder a you get closer to it and a high degree of confidence that whatever the foh engineer mix will be heard in all the seat which those with touring experience can confirm is a relative rarity in venue of this size even with limited option on the table a small change here and there go a long way a always comment question and alternate approach are welcomed wishing you all a wonderful holiday season,1
ti the season of touching the console and getting a static shock every  minute or do i just shuffle my foot more than the average person,1
yet another comm post hey folk first off i'm a video engineer not an audio engineer so please be gentle and while we're on the subject of comm just want to say how grateful all u vidiots are that the task of comm often fall on your shoulder and what a wonderful job y'all do thank you ok so obligatory salutation out of the way i haz a question and i've done a cursory search of past post and not quite sure i've found what i'm looking for i'd like to experiment a bit with setting up bi directional communication between a party line system like clearcom or rts and a low latency strictly lan voip solution like teamspeak or mumble ha anyone done this can anyone point me in the right direction for wiring solution or written guide the most immediate bottleneck is actually creating a physical patch that doesnt blow anything up i looked on av lifesaver and i'm not sure i saw anything that quite got me from  xlr into trrs and back again with appropriate safeguard though maybe i'm being dense any guidance would be much appreciated,1
can i link two qu  sound desk together i have two qu  sound desk and for an upcoming production it would be nice to have easy access to all of the channel without having to search through layer is there a way to link these two desk together or buy a fader extension or something i don't think plugging something into the dsnake would be possible a i use a dx168 digital expander though,1
whats the best low visibility headworn mic money can buy i've tried shure countryman and dpa headworns though dpa make a mic that is hard to complain about headworns in general just miss the mark tonally for me so i'm wondering is there anyway to go up from dpa or is that the high water mark,1
what do you guy do to pas the time on really boring show that you're just babysitting the console hi there currently bored to tear just watching the desk got about another  hour to go it would be cool if midas programmed snake or tetri into the console how do you guy pas the time,1
not gonna lie i love my job this time of year,1
iems in your humble opinion what are the best in ear monitor headphone to use for live show,1
why buy expensive stuff recently i wa having a whimsical what would you do with a million dollar conversation with my wife we allowed ourselves several different situation and in one of mine i said i would use the bulk of it to buy equipment and hire staff for a touring company her response wa essentially why would you need  to do that couldn't you do it for way le i explained that even though it seems like a lot that much money go very quickly when starting a new business and building a decent size rig from scratch she wa still skeptical i'm having a hard time coming up with way to explain the scope of a medium to large touring company and rig how would you explain production and equipment cost to a layperson do you feel that high end equipment is inflated in price or worth every penny,1
i m playing my first dj set with my sax next month anything i should know about sound checking and making sure i stay in tune,1
question when a lot of singer are on stage with multiple voice on part do you have all bgvs turned up equally i know this is a bit of a loaded question so i will try to be a clear a possible we usually have about   singer with mics on stage usually with  or  harmony accompanying the melody at most our total ensemble is large usually   guitarist  keyboardist drummer bassist and percussionist in addition to the vocal team we usually have a different singer lead each song and are trying to determine how to utilize the other singer in the best way when i listen or watch live recording with numerous singer it seems i can only pick out   voice even though more are on stage i wonder if some more professional production mute or turn down mics to keep the mix cleaner thought,1
trade booth studio monitor or pa speaker i know a lot of people say don't use studio monitor for a party but how about a trade booth,1
ksm  on snare thought about trying this next chance i got a long way off unfortunately thinking with the pad engaged it could work pretty well ha anyone here done this what kind of result did you get,1
shit got weird tonight,1
f hip hop show gosh darn these people are so unorganized and unreasonable i just gotta vent it out please tell me i'm not the only one who deal with a shit show doing sound for rapper,1
earthwork piano mic system buzz any tip if you hold the gooseneck it dampens it and clear it up any success in mitigating that i m gonna try some foam between the bar and piano yamaha  and of course gaff everywhere i can think of,1
mobile p a left/right,1
one cannot trust musician,1
monitor world for a recent holiday concert,1
need a monster subwoofer thinking about buying this sub to go with my ps12p loudspeaker looking for recommendation on if this will give me strong enough low end by itself is there a more powerful  in the same price range used for djing techno and house i want to keep it fairly portable   long mcquade com/25502/pro audio recording/subwoofers/yorkville sound/parasource  watt peak  active subwoofer htm,1
community theater rig looking for idea i've put together a small rig for the community theater here and am looking for idea on way to improve it  x air xr18   shure dual wireless mic pack  driverack  with rta mic  laptop usually my macbook air soon to add a pc for others to use  scarlett  usb dac normally stolen from my desk  stream deck surprisingly awesome for show  in the main venue i've added some shure hanging lav  my spare mixer bheringer x1222usb  wireless router since the x air built in is a bit lame  x touch  fire  tablet fire  tablet phone whatever is handy to run around the theater with the  is my goto for tuning  led strip light with a dimmer on a  that i run across the entire sound table gooseneck be gone  usually yamaha dbr12s for stage monitor small bheringer for backstage monitor the x air is a great rig but i have to admit that i'm considering getting them an x32 when i spec'd the  i never envisioned needing  friggin wireless mics they still end up swapping pack around so a surprise entry here is the stream deck i honestly bought this on a whim for my gaming rig helping out for one show i brought it along it turn out that the thing is fantastic for audio cue i'm even tempted to run one over to the director so they can kick off sound effect each clip is assigned a button and you can quickly build multiple screen for the last show there were  audio cue we were able to nail them all easily with the stream deck the hanging lav have saved u more time than i can count unfortunately there's a projector setup in center stage and i can't hang mics there i have mics mixer and driverack mounted in an odyssey fz1004  slant case it's really heavy despite being loaded with relatively lightweight gear and a pair of furman power strip to plug everything in is there a good lightweight option setup is much easier despite the weight usually it's just a matter of hijacking some cable to run monitor/stage feed i use the house wiring and coupler to reverse the xlr flow and i takeover the master output from the house board the house board ha some issue so i avoid slaving into it anymore thing i'd love suggestion on lightweight rack option the case i've been using is a bit painful to haul around i may just put caster on it and call it a day good way to extend the x touch for live show the slider are great but without some midi software control the button on the right are just pretty light it seems that i can dual use it a x air control and then pull midi data via the usb interface at the same time good way to general mic center stage i've considered   crown pcc  or maybe some stand mounted 'choir' mics aka lav on a stick the idea is to get a bit more pickup for small role or help out when main character have mic issue,1
eaw la  dsp hey all looking to see if there are dsp presets for the la  wedge from eaw possibly pairing several of these box with an amp with dsp and looking to see if there are presets available currently looking at qsc pldx amp but open to other suggestion in that price range edit prospect amp is a pld4 ,1
band that kick people out during sound check piss me off band that kick people out during sound check piss me off that go double after their door people were the one to let them in and triple when the early audience is being chill and quiet just wanting to see their fav group getting set up or whatever i just saw someone get booted from the sound check at a show after the ticket collector encouraged them in to grab their spot the staff were polite everyone wa fine drunk a hole being rambunctious disturbing the process yeah i get that quiet fan just chilling they ain t harming anyone let them hang out and watch just a pet peeve of mine /rant,1
like i said before redundancy is key,1
shure glx discussion honestly i have never had any reliability with these microphone some day they are okay but most of the time i get really bad interference i use them in house of worship and then i work for a production company that supply a system to a band and they have them even with the glx d distro would love to hear any solution to getting a better consistency or anything folk have tried and have had success with,1
i think i've blown up my speaker and need some help hey guy hope you're all having a good weekend just want to say that i'm a complete newbie to this kind of stuff so i'm sorry if this may be a little unclear anyway a i mentioned in the title i think i've broken the driver in my pa speaker cab these speaker cab i bought second hand the brand is netsound whoever that are and the model is a bb b15 i also bought the powered mixer from the same bloke he ha used these speaker with this mixer for year and ha never had an issue i've posted a link below of some photo of the gear i'm talking about anyway i wa jamming with the band the other day and both speaker just stopped no bang no smoke just stopped i thought it might have been the amp but the interface it wa plugged into wa still receiving signal so it ha to be the speaker both speaker are the same  ohm with a rated output of  watt the mixer ha a minimum  ohm output and is rated for  watt so it would be impossible to overload these speaker on this amp right right i've tried the same speaker on a different amp and still had no sound come though the speaker checked all cable and no worry there next i opened up the speaker and tested continuity between the input of the speaker and where the wire attach to the  driver that wa all fine too the speaker cone move free and aren't scratchy at all the also don't have any tear or dent in them i'm at a loss i need these thing running asap it wa only running at around  load when they failed any advice would be very much appreciated thank you for taking the time to read this   com/a/cujjmwd   com/a/cujjmwd,1
important qsc k  firmware update please share with your friend the new qsc k  series firmware update solves a bug that might make the   model fail to turn on we had this happen to u once the update is easy to install using a window computer for more info check out the download page   qsc com/live sound/products/loudspeakers/powered loudspeakers/k2 series/k2_firmware/,1
frustrated with loudness complaint i have been working at this venue every weekend for about  month it s inside a casino with a bar placed in the middle front of the room about two week ago i started receiving noise complaint from the food and beverage manager saying that they were getting complaint from customer the real story is that the bartender were complaining i had a  piece band last night with  wedge and right when the band started the bartender started screaming at me that it wa too loud i nodded my head and walked away i don t want to deal with this shit i want to do my job mixing and making sure it s a good show i don t know what else to do i had the main almost off and just the side fill were doing all the work it s frustrating to be in a position where i am responsible for the bartender to be able to hear when they are stationed basically directly in front of the stage i liked this job at first but now i am having doubt because of these complaint and i don t know how to resolve it,1
trying to set up mic for streaming and it sound really muffled so i got a new computer and set everything up for my stream and this is what i sound like   twitch tv/videos/349207399 t  really muffled however recording in audacity sound great a well a when i plug headphone into it using the blue snowball ice voicemeeter bananna and ob and discord seems like something is causing the issue when voicemeeter sends everything to discord or ob but i dont know what here my banana setting   com/a/uz04kp6 thanks for any help you guy can offer,1
monitor world tonight,1
i think we might have to re align the sub,1
hope this count,1
got to the venue and they have a mystery switch,1
question regarding multiple volume control and how to set them i have the xr  which i love although it's taught me that i really need to learn more about sound engineering one particular issue i need to tackle come from a use case i have namely using it a a glorified headphone amp for my live show i intend to take the various iem feed from foh and plug them all into the xr  then each aux out will go to a performer it might seem like an extra step but i believe it's justified foh doesn't have to solve any puzzle of getting a feed to everyone across the stage and people can share monitor mix if there aren't enough auxes happens a lot sadly where i get stuck is how i should set level for these incoming feed there are so many place where the volume is potentially affected  how much foh put in their aux send  how much gain there is on the channel that feed is going into in the xr   the channel fader level in the xr   the aux mix fader level in the xr   the input gain on the wireless iem system's transmitter  the volume control on the receiver that's a lot of step i want to make sure assuming foh sends a strong signal with no clipping that i can retain that strength all the way to the band's iems any advice would be most appreciated,1
best mic for quiet vocalist hey everyone i'm wondering what mics have worked best for a quiet vocalist in a loud band the singer in my band ha a very soft voice with a lot of reverb on it we recently switched her to a iem setup which ha helped a ton with stage feedback issue the issue we are facing now is cymbal bleed into the mic we are mostly playing small club size stage so regardless of the vocal placement it's always relatively close to the drum our tech last night said that the vocal reverb wa hitting the drum super hard and also the drum were bleeding into the iem mix a lot i know some sort of hyper cardioid pickup mic would work best but i'm wondering what experience people have with each one we have used a beta  time to time but have found the output too hot and high a little harsh,1
help with midi hi there i'm planning to use multiple midi controller with mainstage running through my macbook obviously it doe not have enough usb post for all of the device so would something like this work with standard midi keyboard into a mac will it recognise each device separately for use on different patch any help with this would be great thanks,1
