post_lm,is_ls
news on apogee duet/quartet update i own the apogee one and it's been really great recently i've been eyeing the apogee quartet it seems like the perfect fit  combo input  output great for outboard gear native control via logic pro nice design/footprint made in the u but it wa released in  it's a usb  interface it's   i wa wondering if there are any rumbling about update to the one/duet/quartet line,0
is there anyone who mixes/masters stuff in the hip hop genre that could help me understand a few things/answer a few question hey everyone looking for someone to ask a few specific question nothing too technical or anything like that just looking for advice on creating a sound that i like and that i m comfortable with thanks in advance when mixing and mastering would you need more than just the vocal/beat mp3 file a in would you need each sound track separate is there a way to master vocal audio to match an mp3 file of a beat/song whose sound i like already seeing a some engineer are expensive or too expensive for me what are some great step to get started assuming i have a very elementary understanding of music a a whole but i have an immense passion for creating,0
what bass amp size to record sick tone so i have a massive live rig but i honestly feel that it is a bit impractical for recording so i'm looking at a fender rumble  it ha a di out so i'm covered that way for recording purpose is a smaller amp or larger amp preferred,0
part  ikea diy plate reverb it sound good now hey audio engineer i just posted part  of my diy ikea plate reverb hack series it's funny how a couple of small/cheap change make a big improvement in the sound it's still cheap le than  in total but it actually sound like a pretty decent sounding plate reverb now anyway hope you like it   be/5ocrma2fnue   be/5ocrma2fnue,0
confused about my fader reading and loudness i am mixing an album using cubase  pro recently i have been getting a lot more into the nut and bolt specically dbfs lufs and metering the track in question ha arrived to me from the studio quite quiet after doing some mixing and balancing i'm getting an integrated lufs of  i noticed how quiet it wa when i had to turn up my speaker to hear the rough bounce of the raw recording i am trying to get each track to peak at  on my fader's meter peak level this is  which is a good target right my my stereo out is peaking at around  yet my integrated lufs is much lower so a few question  should i ever push the faders above  is this an instance where i should  when would i increase the gain in the channel setting instead of pushing the fader what's the difference  doe my mix have a lot of headroom doe this mean that i can simply push the master fader when mastering to achieve a more standard lufs  what do i do with quiet track in this particular song there are brush on the drum which need a bit of a boost currently i'm bringing the other track down to match but this is resulting in a quiet mix overall how do you deal with quiet individual track that are too quiet for the mix thanks,0
how do i make spoken audio sound like a recording from the  i'm working on a video project that requires audio which mimic the audio quality used in  television how would i go about doing that i use audition and have been unable to find any information on how to degrade the quality,0
question eqing reverbs before or after it what are the pro and con to eqing reverb going into it versus after it and what are example of when you would do either for guitar reverb i put the pas filter on after the verb but i just watched pensado eq into a verb on a vocal track,0
home recording analyzing your room's acoustic to get flat v making your room sound good to you plenty of u are home recording enthusiast it's a hobby we enjoy so much that of coming home layering many instrument together on a melody or progression we've been humming all day getting that flow going and experimenting with new sound we want to create our lab hand picking every piece of gear for a specific need and using it to death learning everything we can the big part of research is how we get our room to sound our monitor of course are affected by our room our recording whether they be vocal or some other acoustic instrument are dependent on the acoustic of our room but for most of u that room is a bedroom or an office or some other space we need to be both liveable and aesthetically pleasing lately i've been identifying flutter echo or high frequency build ups in my recording find where the noise is coming from and slapping  rockwool or fiberglass on it i'm sure many have got to this step now i hear hey the more high frequency reflection you eliminate the more the low end mode will shine through you should get some room analysis software and equipment to measure your room mode and rethink placement also  inch is better than  inch that's when i had my moment how far do i want to go am i producer/recording artist if so do i really need a perfect room or do i just need to tame the flavor of my room maybe i should pay other people to mix and master my music who already have the perfect sounding room anyway that's the discussion i wanted to have i think i'm just gonna slowly fix problem i identify in my process and fix them one by one and a far a having the perfect room i'll leave that to the professional,0
how doe stereo width work for context say you have a stereo track and you adjust the pan pot to make a  angle this will bring the stereo track more into the centre of the mix now say you adjust the pan pot so they now make a  angle this ha the effect of widening the stereo field but i don't understand how this work i've researched mid/side processing and understand that mid is the content that is identical in both speaker whereas side is the content that 'differs ' but how doe this difference result in width and how doe something spread wider into the stereo field i hope the question make sense thank you all,0
building a studio in a rehearsal room hello everyone i have a band and we decided to renovate our rehearsal room before we were sharing the room with  other band but we kicked them out and brought on board some producer who are willing to make this a studio and rehearsal room with u meaning only our band equipment monitor pa and computer rack desk will be in the room budget is low why we won t separate control room and studio or build a room in room construction the idea is basically to record our band on multiple track while jamming or rehearsing and for the producer to have a somewhat nice sounding room while being able to record external musician it s a basement room of ca  with tapestry and plasterboard wall and ceiling since none of u ha ever done this before we don t know what s best for the room ha anyone experience with an opened control room like this should we stick to the live end dead end principle i m very excited about this and would be happy to hear what you guy think,0
podcasts any good podcasts y'all recommend that can be heard on spotify specifically any on hip hop rock indie music or mixing and recording,0
anyone successfully rocking hackintosh a their primary machine for mixing/tracking/production in a professional environment anyone successfully rocking hackintosh a their primary machine for mixing/tracking/production in a professional environment i tried it once upon a time  and concluded that it wa too risky ha it gotten any better in recent year specifically if there's anyone who trust a hackintosh for their day to day rig i'd love to hear from you for instance do you still have to keep updating kexts and whatnot every time apple release an o update etc thanks,0
ha anybody used both older and more recent oktava mk  i'm currently in the market for a new pair of matched sdcs and the oktava mk  really keep catching my eye the only problem i see is that in older production run they had quality control issue that ultimately led to michael joly's oktavamod company a joly ha gotten out of the business of modding mics i'm curious if anybody here ha experience with older  and a newer pair if so doe it seem like oktava ha ironed out the qc issue they were having,0
tip trick tuesday december   welcome to the weekly tip and trick post offer your own or ask for example how do you get a great sound for vocal or guitar what maintenance do you do on a regular basis to keep your gear in shape what is the most successful thing you've done to get client in the door daily thread monday gear recommendation sticky thread   reddit  q title  author  restrict_sr on sort new t all monday tech support and troubleshooting sticky thread   reddit  q title  author  restrict_sr on sort new t all tuesday tip trick   reddit  q title    and   or author   restrict_sr on sort new t all friday how did they do that   reddit  q title  author  restrict_sr on sort new t all upvoting is a good way of keeping this thread active and on the front page for more than one day,0
suggestion on setting pricing i run a small studio out of my apartment and specialize in vocal guitar acoustic electric and bass beat production and mixing for digital release how do you set pricing for your work i find any time someone asks me for rate i second guess my credibility or work space and wind up low balling myself,0
are there any good magazine for audio production/engineering out there,0
console eq plug in this may sound like a real dumb question but can someone describe to purpose of using emulated ex wave api series console eq s inside the box i understand the ssl compressor and such because of the classic sound and warmth of course but what about these eq s are useful besides gorgeous and lush cut at certain interval compared to the versatility of a state of the art eq ex fab filter q2 please do not thrash me for an ignorant question i just want knowledge thank you,0
mixing edm am i doing this right and how can i improve hey i'm mostly drum bass/techno producer i wanted to ask you for advice this is my usual mixing process when producing a track i put limiter on the master so the max volume is  i know i shouldn't but haven't found workaround yet i rely mostly on audio level because this work best for me all element in my track always have fixed volume level kick and snare  sub bass sidechained and mids  percussion  pad and synths  to  cymbal and shaker  to  people often compliment my mixing and this work fairly well on deeper/calmer tune but when there come a little more distortion and saturation the mix doesn't work quite right anymore do you know any useful tip and technique,0
is this a thing already so i thought of a program that can be made unless it's already a thing where you could build a floor plan and designate a spot where the audio source is coming from and the program would calculate the room thing in the room and the wall then it would apply the effect to make the sound fit the setting e g reverb eq amplify ect say there wa a narrator and you wanted him to sound like he wa sitting next to or moving around you and your both in a church with the program you could build the floor plan of the church and program the path of the voice then the program would calculate the distance of the voice to apply any amplification and if your subject walk around a wall the program would calculate the thickness and material of the wall and change the voice to match what it would accurately sound like is this a thing already and if it's not why not,0
using a single reverb/delay on all part in a mix i've toyed with this idea for a little while but finally gone through with it i set up my latest mixing project so that all of the individual component of the track drum guitar 'body' go through a single reverb and delay auxiliary to try and create a greater sense of cohesion and 'room' in the mix it's hi passed at around  to cut out any low end rumble and the bass doesn't go through it at all so far i'm really pleased with the result but are there any pitfall i should be aware of doe anyone else here do it this way,0
what are some tool that someone that can only hear on one ear can use to understand panning and directional sound i've been completely stone deaf on my right ear from birth but i've always loved music i got into sound engineering about  year ago and this ha always bothered me a i have never experienced stereo i have no idea how it actually sound i know the theory well enough but the complete lack of practical experience feel limiting for me are there any tool physical or on the computer that could help me understand the feeling of stereo sound even if my head only ha one input,0
gear recommendation what should i buy thread december   welcome to our weekly gear recommendation thread where you can ask  for recommendation on smart purchase low cost gear and purchasing recommendation request have become common in the ae subreddit there is also great repetition of model asked about and advised for use this weekly post is intended to assist in centralizing and answering request and recommendation if you see post that belong here please report them to help u get to them in a timely manner thank you daily thread monday gear recommendation sticky thread   reddit  q title  author  restrict_sr on sort new t all monday tech support and troubleshooting sticky thread   reddit  q title  author  restrict_sr on sort new t all tuesday tip trick   reddit  q title    and   or author   restrict_sr on sort new t all friday how did they do that   reddit  q title  author  restrict_sr on sort new t all,0
recording key with keyscape hi all so i'm a piano player that want to record a few instrumental album i have limited working knowledge of daw and understanding of mixing/mastering however i am learning and know the basic i wa wondering your thought on recording midi from my keyboard yamaha dgx  and then using keyscape piano for the sound i did it for a simple christmas album that a friend produced and he used piano from some sort of abbey road suite and i like the result what do you think would be the easiest way to accomplish this i haven't bought the keyscape package yet going to be my christmas present to myself so will it be better to get omnishphere or just use my protools to record doe omnisphere have the option to record the audio a it's played thanks for your help and thought edit if this belongs under tech support thread let me know frankly i couldn't figure out how to post it there,0
how do i open and edit snd file iv'e tried using audacity window medium player vlc medium player and changing the extension name to mp3 and wav nothing work i reverted it back to snd whatever i use say the codec isnt supported or it corrupt i know for a fact it not corrupt because it part of a game sound from fmod and the sound in game work fine,0
tech support and troubleshooting december   welcome the  tech support and troubleshooting thread we kindly ask that all tech support question and basic troubleshooting question how do i hook up 'a' to 'b' headphone v mon etc go here if you see post that belong here please report them to help u get to them in a timely manner thank you daily thread monday gear recommendation sticky thread   reddit  q title  author  restrict_sr on sort new t all monday tech support and troubleshooting sticky thread   reddit  q title  author  restrict_sr on sort new t all tuesday tip trick   reddit  q title    and   or author   restrict_sr on sort new t all friday how did they do that   reddit  q title  author  restrict_sr on sort new t all,0
midi drum too sensitive first off i'd like to say that i am not a drummer whenever i record my midi drum the snare always register  or  extra hit after the first initial hit i know that this is normal when the stick try to rest on the drum but these hit are extremely audible during playback it just sound like a snare roll every single beat is there some kind of gate i can trigger or is there any possible work around,0
why people don t trust in u today there s a choir where i work a friend of this guy want to record the performance on an analog outboard for vinyl he tell me that he do this for passion and he doesn t know how to record properly i give him my help for record every single second of the perfomance he try to fix that fix this frequency are muddy why the l meter is lower than the r meter i can guarantee that the record is nice and clean i promise u but why and why this type of people doesn t listen to the stuff while they lost their mind on meter and other bullshit why they doesn t trust in u we are audio engineer we study for this we make a lot of exam we produce/mix/master our shit every single day trust in u we re audio engineer for a reason sorry for bad english and for rant i hope u can understand this type of situation my guy thank u edit the guy us beat headphone for listen what he record re edit he call me today and tell me that the recording sound amazing and he never had an experience like this with me and this because he listen my suggestion not his passion skill,0
help in over my head tl dr wanted a career change early in life and started doing work for a sound production company didn't even know what an xlr cable wa but they liked me enough to bring me to more gig i'm still not confident in what i'm doing though so i'm looking for any free books/courses/resources to study up with before the next gig on new year's hello i used to be majoring in computer science but after working in the field for a few year already hated it i've always loved music and been interested in getting more involved with the music industry so one day when i saw an ad looking for help with our yearly local music fest i joined i had  knowledge about anything audio related but i did what i wa told did it safetly and correctly and stayed out of the way a the amount of crew needed got smaller i wa continuously invited back now i just got asked to help with our town new year ball drop by the company's owner the company doe light and sound production for local events/festivals/concerts i want to show him that i'm serious about getting into the industry and know my shit but i really don't know my shit i never studied anything related in college and after withdrawing before getting my c degree can't financially go back i've tried learning independently but without even a base level of knowledge it's difficult i'm eager and willing to put the time and dedication in but just don't know where to start i'm looking for a kind of 'audio tech for dummies' guide to get started with or any pointer to the kind of stuff i should be looking for and what i would be expected to know any tip and help is greatly appreciated thank you everyone for reading,0
anyone else think that  production aged much worse than even the  or  seriously that sterile early digital sound make some album borderline unlistenable to me terrible sounding drum bright cheesy synths fake as reverb all track detached from one another blonde on blonde from the  sound like it could have been recorded yesterday same with the beatles' stuff then dylan and mccartney's stuff in the  sound sonically like trash so cold and aloof love some  music but can't stand the production i wish the smith had been around ten year earlier or later what do you think am i way off base here,0
doe anyone have story about running into some choosingbeggers or someone trying to cheat you out of your hard work,0
acoustic guitar di mixing heyo any idea on getting an acoustic guitar that wa tracked with a di and not a mic to sound more natural and lively no matter what i do i can't get it to sound good i've tried a bit of a faux room sound with some reverb but it still sound quite harsh i wish re tracking were an option but it currently isn't,0
suggestion for diy mounting of audio interface under my desk steinberg ur44 i have a ur44 audio interface i'd like to mount under my desk depth   width   height     sweetwater com/store/detail/ur44 steinberg ur44   sweetwater com/store/detail/ur44 steinberg ur44 just based on my browsing i haven't found anything that look like a great fit for this any suggestion that don't involve ghetto solution like hot glue or  tape also if i'm posting this in the wrong subreddit please let me know what would be a better fit,0
doe anyone happen to have a behringer epa900,0
are top tier engineer / producer accessible i m taking a class next quarter which ha a requirement that i interview a successful industry professional i know a handful of very successful performer but i m studying music production so i thought it would be more valuable to interview a producer or engineer i thought i d throw some hail mary s to producer and engineer from some of my favorite album i e mitchell froom and tchad blake in hope that they may be willing to sit for an interview or answer a few question via e mail however i can t seem to find any website or contact information for any of them i kind of expected that they would all have website where i could at least send an inquiry even if it s ignored am i underestimating the celebrity status of grammy winning engineer and producer am i doing the equivalent of asking taylor swift for an interview or are they just so embedded into the industry that people who need to know how to contact them know how to do it and they don t need to put contact info online doe anybody know how to find contact info for engineer and producer who have worked on successful album,0
is there a way to listen to  device through one set of headphone i want to play my e drum kit along to a song is there some splitter cable that i could plug in to my phone to hear the song and my e drum kit to hear the drum and then plug my headphone in to the splitter so i can hear both through one set of headphone,0
what unorthodox technique do you like to implement into your mixing i wa rewatching a virtual riot livestream the other day for like the  time and i picked up on the fact that he turned the limiter off of the drop in one of his track i believe he said it wa for the hard clipping that got me thinking what other unusual technique do you like to use to spice thing up a bit,0
just a tip for all of you audio engineer if the elastic band on your condenser mic shock mount get loose the dollar tree sell black elastic hair tie they fit perfectly and you get  band for a dollar they have a  pk but they're pretty thin the  pack are the same thickness a the traditional band sold at music store i hope i saved you some money,0
weekly office pic thread week of       post the picture you took at your gig this week,1
no stupid question thread week of       the only stupid question is the one left unasked,1
the best production timelapse i've seen so well done,1
wireless router/mobile app for a h qu/sq series just looking for a quick tip regarding buying wireless router for the mixer i work a lot on can i just buy whatever or is there something i should watch out for i've heard good thing about allen heath app and i find myself doing gig where i get stowed away in a trap corner so to speak more often so it would be extremely convenient to just adjust eq while walking around the room on my phone instead of backtracking to the mixer everytime i need to do a quick change any experience with the app or similar thing you can share,1
the realest of reverbs,1
question can i cover the back of my ldc for live use i'm playing a few tune at a small holiday gathering on thurs i want to mic my vocal and guitar but will also play with a violinist and a vocalist will be different personnel for different tune would love to have one mic cover u all for ease of set up plus it'll be in a small private room not a club can i just use my at4040 ldc mic and cover the back of it with some foam/cardboard so it doesn't pick up extraneous room noise could also use a couple of sdcs rode nt5s thought,1
touring guy do you rsvp to anything  month in advance,1
tip for wireless mic being passed around i made the mistake of improperly setting up a gate before a show on a handheld wireless mic it caused some feedback when a guest at the reception grabbed it to speak i had it saved on my scene from a previous show where the mc wa dancing with the crowd and carrying the mic around the room any tip for knowing when to generally use a gate on vocal any tip on dealing with different people grabbing the mic and holding it different distance from their face what would be proper gain staging in this scenario,1
sad shure sm81 any idea hey  been a bit since i've posted i've got an older model shure sm81 here that barely function you can hear audio at extremely high gain only  yes i am using phantom and for anyone curious i've checked it on an m32 and on my scarlett  since i'm a diy kind of hooman i'd like to repair this at home if i can in my head i imagine it's just a connection problem somewhere doe anyone have any idea about this anyone cracked one open before thanks for any help/comments/opinions happy holiday,1
recommendation for budget top and sub hey all i'm in a smaller bar band and looking for recommendation for  main and  sub i know this will make everyone roll their eye but i'm on a smaller budget i'm torn between getting powered or passive if i go passive we're looking at the new behringer nx4  that's a  channel  amp i'd like to keep the top around  a pop and the sub around   a pop is my budget too small again it's just a  piece rock band in smaller bar so i don't need to blow anyone away i appreciate any input,1
have i got a blown mic capsule,1
