post_lm,is_ls
soundcraft signature mtk  hello are you're having a nice day i hope this is an okay place to ask this question i have been using this mixer for a bit now and it's solid i'm having an issue at the moment where the signal to my pc is half or le what it used to be i am aware of my gain staging and i'm trying to keep the gain a low a possible on the mixer but when recording my op  into my daw the signal is super weak even though it come out strong through the op  itself or through my monitor my eurorack is also running kind of cold into the pc not out of the monitor especially for eurorack it's very confusing to me in pfl the op  is showing  on the soundcraft's meter but i'm only getting  in reaper i'm using reaper on window  should i just rely on normalization to beef up my wave form after recording them thanks in advance for any suggestion,0
any advice on improving my volume automation what are general tip or idea when attacking this do you guy automate every channel or do you leave vocal alone and automate throughout song around that,0
expanding apollo w/focusrite i'm sure this is a dumb question but i'm having trouble figuring it out i have an apollo  firewire interface a my main interface i have my old focusrite  just sitting on a shelf would i be able to connect the  into the apollo  to expand my input to ,0
good earplug / filter hey audioeng what are your go to acoustic filter / earplug for attending live show i'm looking for a relatively inexpensive pair something that i can recommend / buy friend a well thanks in advance,0
where do you guy get your lossless reference track for mix referencing spotify is nice it ha everything but the sound is far from lossless and for some artist it is really difficult to find cd or even downloadable lossless content how do you deal with that is there amazon like place to get downloadable lossless content that i ignore,0
will i ever understand compression ahh yes my monthly compression post i 'get' the idea of compression but i am struggling so much with how to hear what is reasonable/appropriate/too much when adding compression here's my understanding and please correct me on any or all of this threshold the point where the plug in actually kick in ratio how much of the sound over the threshold is compressed attack length of time before compression kick in release how long compression is held for makeup gain getting the 'lost' volume back from the compression i'm trying to start with understanding the logic house compressor i've picked one to learn studio fet my problem is i can see the needle move and know something is happening but i just can't tell if i've found a sweet spot am i monitoring the whole track while getting the compressor right or picking a particular good point where there might be loud word or soft word and looping it till i get it right i've watched ton of video explanation animation you name it but i just can't get to grip with it i think i need some exercise that will let me practice compression i have a lot of recorded vocal and acoustic guitar so plenty to work with i just need to know what i'm listening for and how to know when i've done it 'right' which i know is subjective also another question i have is do you treat your compression like a mathematical equation i find myself trying to do math with the radio and db's blah blah blah thank you in advance,0
reverse compression this is probably an easy answer but just something i have had a bit of trouble with i mix live recording from a music venue and some acoustic artist have such a huge dynamic range that some of the softer part get lost a the level is set to suit the louder section i don't want to compress the louder section down i just want the level turning up if the audio go below a certain threshold is this a thing,0
doe the audio interface have an effect on sound quality i'm currently wasting a presonus firestudio project  channel firewire my parent bought it to me but they decided to place it in the living room and use it for music listening with a pair of dynaudio bm5a monitor sound amazing i'm planning on buying a cheap usb one channel audio interface and put it in my room but i recently had the idea of swapping them and keeping the firestudio to myself will there be a noticeable difference in the sound quality for music listening between using the cheap or the mid range interface of course using the same monitor thanks in advance,0
i am interested in listening to a mix with all compression plugins turned off including master compared to on is anyone willing to post their professional or semi professional mix with and without compression for learning purpose preferably not rap or edm of course this would have to be a mix where no analog compression ha been applied,0
please help me with my effect im using a zoom g5 with my saxophone so i connect it with the xlr output on the side of the output there are  button called pre/post switch and ground switch on the zoom manual it said pre/post switch use this switch to set the point when the signal is output from the balanced out connector set it to post pushed in to output the signal after the effect set it to pre not pushed in to output the signal before the effect ground switch use this switch to connect or disconnect the balanced out connector with the ground set it to lift pushed in to separate the signal path from the grounding pin set it to connect not pushed in to connect the grounding pin to the ground i don't really understand the instruction since i'm not familiar with pedal how would i know whether i should leave this two switch pushed in or not most of the tutorial on yt don't connect by xlr cable so i came to ask this sub also what is a ground signal,0
instrument guitar/bass gt d i box gt mixer gt interface gt daw is it possible record mono can i record all these on mono and is it possible for these connection to be made if a microphone then yes skip the d i straight into the mixer new into this home recording thing first post d,0
rack mounted / analogue mpressors i'm currently studying music technology at college and this ha given me access to a studio that ha a lot of analogue gear a someone who's only ever used my daw built in compressor i wa mainly wondering if i should be using them in the same way i'm assuming the analogue compressor are going to colour the sound a lot more than the stock software one will but is there anything else i should know/be aware of when using them,0
mix lacking energy and punch hi everyone i ve been recording and mixing for a few year now and i feel a though i have a grasp on the fundamental i mainly work on rap and r b but do the odd rock record here and there lately i ve been comparing my mix with industry one and the one thing i ve noticed is a considerable difference in loudness energy and punch a couple of thing i do notice on big record these day is that the vocal are loud a hell and in your face the  or synth bass and kick are the second loudest and the snare or clap is tucked neatly right behind the lead vocal couple track i m referencing are no stylist by french montana and kika by tory lanez i ve tried so many technique parallel compression rear bus compression m/s eq saturation soft clipping on drum etc no matter what i do i find i still can t get that sound that i hear in those record the last thing is that i m scared to death of making my track too loud for spotify a it just turn them way down a i ve received some nasty email from client in the past about this if you re interested i can post some of my work i figured this is the best support system i have might a well see what the community ha to say always appreciate you guy,0
if i faced two speaker towards each other one playing a sound and the other playing the inversion of that sound and i sat halfway between them one facing my face and the other the back of my head would i just hear silence,0
what would happen if you subtracted frequency of one sound from another so sidechain compression is used to say make the bass quieter so the kick can come through what would happen if you instead reduced the amplitude of frequency on the bass line by their exact correspondence in the kick drum so subtracting those frequency from the bass line what would happen if you added attack and release on this effect what would happen if you did this without playing the kick drum sample at all what effect would be left on the bass line what would happen if there wa a percentage for the effect the bass line frequency were only reduced    of the corresponding kick drum frequency what if you did it backwards so that the kick drum frequency came through at  but all other frequency came through reduced sorry for all the question rather than an actual post i don't know how to attempt this effect so i have lot to wonder about also a an aside is this how subtractive synthesis work thanks,0
what are some simple exercise to practice compression when you have some time between client what are some way you practice your compression skill how do you know you are practicing properly and efficiently,0
cost of rehearsal studio buildout hey everyone hoping for some direction here i am in the process of buying the business asset of a rehearsal studio building however the building itself will not be around much longer and we need to find a new place to go i have probably  month before the owner of the new building would start swinging a hammer unless i can convince them otherwise in the past week my head ha been spinning doing my own research on the cost of construction for these type of studio and what is truly required it s been all over the map literally from  to  i ve also been told that a new construction on land is financially off the table compared to finding something that already exists and doing a buildout the current studio ha more than  unit most of which are  sf trapezoidal practice room with a couple higher grade area of   sf with light rack and leprecon controller for larger act and hourly rental there s not a single right angle anywhere all area between the hall and unit are double dry walled air in between not insulation two set of regular old door and the ceiling wa hung suspended independently of each unit with tile to capture noise a for the floor it s concrete and there is some travel between unit they compensated by cutting groove into the foundation and placing wedge i m sure that s not the technical term between unit in the area between the double drywall the largest speaker in the building are meyer cq1 s and a lot of  with quite a few isp  watt wedge monitor on stage buttkickers are used pretty frequently by larger act that come in and in my experience do travel between the unit those are in the larger space by the way the smaller  sf space have minimal equipment or the musician will bring their own usually non stack amp foam wall pad are sparsely scattered throughout and all look second hand / salvaged this is by far the best constructed non professional rehearsal space i ve used the way my first space i rented  year ago wa in an abandoned leather building and the other space i had rented out wa an old elementary school both of them basically just lined the wall with carpet and called it a day now if we do lose the building and i m forced to start anew i have a lot of question in order to maximize my investment i m not sure each of the practice room need the cadillac treatment but i don t want my tenant surrounded by rotting carpet either so i m open to opinion on where to shoot for quality wise other than that a what should i be looking for in a building an empty shell an office to retrofit i m assuming single floor how about height b construction labor rate are quite high at this time thanks to the booming economy and the last thing i want is to end up with double cost in twice the timeframe are there any tip here on managing this are there pre fab material i can use to get a better handle on exact costing or would that be astronomical in comparison in a perfect world i would want to be able to accurately cost the  sf practice pod and then get creative with the larger space to accommodate to the crowd that would be willing to pay more daily/monthly c are there specific guru in this industry that cater to these type of building in the past couple week i have gotten a lot of head scratching from financier contractor and architect who can t quite wrap their head around the concept of these space it would be great to find a resource to help me get right to the point d am i completely crazy any sage word of advice from someone who s ever been in a similar situation i really appreciate the help here it would be the achievement of a lifetime to save this space i just now wish i had a few year of construction management under my belt thanks all you re helping someone fulfill a dream here,0
i'm interviewing to be an intern at a big studio tomorrow what question should i ask edit i'm getting downvotes why edit2 i got the position thank you all for your great advice,0
eq and compression in analog signal flow how do eq and compressor operate in an analog context i ask because i have been working strictly in the box for my entire time a a producer i simply can't imagine that a separate compressor and eq would be acting upon each channel at once in an analog mix a would be the case in a daw is each track printed after the desired setting are dialed in and then the compressor or eq can then be used to work on the next track thanks people,0
rode nta  capsule swap edit may also help if i could type the mic's name properly nt1 a hey everyone i've used the same nt1 a for about   year now never modded it now that i'm getting serious about music i've been looking into how to upgrade it i came across the rk  at mic part   part com/products/rk47 microphone capsule   part com/products/rk47 microphone capsule my question ha anyone completed this swap if so doe it make a difference significant enough to warrant the cost/labor finally how difficult is the actual swap itself is it a diy project or should i take it to someone thanks in advance,0
how to get vox to sit in the mix i keep getting told on r/ratemyaudio that the vox doesn't sit well with the mix but what doe this mean and how do i accomplish this,0
live mixing simulator is there such a thing a a live mixing simulator i would like to get some practice and fiddle around without having to ruin many live show that may count a quick google search didn't give me anything doe this exist at all,0
any fun book you could recommend a gift my brother and i are both into home recording he's  and know what he's doing doesn't need how to book unless it wa pretty unique are there any fun or interesting book on audio you like edit thanks for the suggestion i'll go with recording unhinged and a guitar pedal,0
ever used spectrum sonics the  and v610 were pretty neat complimiters anyone else use anything by them,0
making a guitar amp i am looking into making my own guitar amp for practice cause i don't want to pay for one i can make a box and i know a brand that make good driver for cheaper but i'm not sure about impeadence in guitar i think it's around  mil and if i get a little chinese class d amplifier which i plan to the rca level input i'm pretty sure are usually around  ohm but if i put an extra  ohm resistor in paralell with the guitar it should bring the impeadence down to around  ohm am i off my rocker or could that work,0
how do i know when a single sound is spectrally correct hi all thank you for your time i have a question that is more philosophical than technical how do i know when a single sound or track is ready or correct frequency spectrum wise is there any standard to satisfy every perception is it just arbitrary or should i just reference it two example i have this footstep on sand sound and i feel i should put an eq on it because it doesn't sound like in the real life i eq it and i feel it is ok now how do i know how much it is ok and ready to be put in a videogame how do i know the high end is sparkly enough for instance i have this track and i reference it to another one in the same genre i tweak it and now it sound very similar and very good to me how can i trust that reference track of success why is it ok why is it spectrum good for everyone thank you,0
help for a total beginner increasing input to a scarlet solo so i'm just getting into recording in my tiny office and wa given an old scarlet solo from a friend i'm a complete noob when it come to audio and have nearly no idea what i'm doing a ya'll already know the scarlet solo only ha two input a regular instrument cable and one xlr so i am thinking about using a cheap mixer and just plugging it xlr out into the xlr input of the scarlet solo so that way i had a little more control and didn't have to constantly try to fiddle with the tiny scarlet solo is this possible or would it give too many latency issue is there any other work arounds you can suggest to increase the solo's amount of port,0
friday how did they do that december   post link to audio example that are apparently created by magic please post specific link in the timeline if applicable daily thread monday gear recommendation sticky thread   reddit  q title  author  restrict_sr on sort new t all monday tech support and troubleshooting sticky thread   reddit  q title  author  restrict_sr on sort new t all tuesday tip trick   reddit  q title    and   or author   restrict_sr on sort new t all friday how did they do that   reddit  q title  author  restrict_sr on sort new t all upvoting is a good way of keeping this thread active and on the front page for more than one day,0
the most insane/bizarre source of random noise i've ever come across so and my brother dj quite a complex setup two laptop two controller synced via an ethernet cable audio from both laptop into a tiny little  channel mixer which then go into monitor speaker for a while thing were pretty crappy so we just put up with the random noise from the big monitor wedge we use it's pretty crap but it's fine for rehearsing and when we play live we use the club's pa system so we'd rather spend our money elsewhere yet today i introduced a new laptop to the setup and the noise wa insane really loud really weird it sounded like someone had placed a tiny microphone in the cpu and amplified the volume  time i narrowed it down to everything it wasn't the new cable wasn't the controller/audio interface it wasn't the little mixer the source the new laptop's charger when i unplugged it the noise vanished zero background noise very clean audio it wa slightly quieter when plugging the laptop into a totally different socket on the other side of the room but still there the noise also still happens when the mini mixer had that laptop's channel muted i really don't get it anyone any idea,0
realistic highball mics built by shure rebranded sm58 i know shure built various model of mics branded a realistic for radioshack and wa wondering if anyone ha tested the different version of the realistic highball       b c etc and how they compare to an sm58,0
eq before or after the compressor i ve seen it done both way to me it always made sense to shape the wave frequency after the signal itself ha been compressed a little bit what are your preference and why edit thank you for the input i meant this a a discussion on all our practice and preference rather than asking what is right because i know there s no rule only guideline great feedback,0
can someone help explain these driver backstory i m not familiar with audio hardware but have some ee background i have some old bluetooth speaker with crappy audio and thought about changing the driver with a some i got out of a broken monitor the old speaker were in a sealed enclosure with matching passive radiator the driver i got out of the monitor are rectangular and have some confusing acoustic the sound clear when you face the driver but without much bass but if you point them down you can hear more bass but le clarity if i try to build a little portable enclosure for them would they need to be in an unsealed enclosure use the passive radiator pointed down or forward etc just curious if anyone who is a familiar with this type of driver what the acoustic consideration are thanks   com/a/nbolvfw,0
how to write or build audio interface usb driver for common daw's logic protools ableton etc i wa wondering if anyone knew how to write or create a driver that allows a device to talk to any of the popular daw's on the market at the moment i'm designing a pre amp that i would like to eventually be used a an audio interface via usb and be recognized a an in/out when connected to a daw basically a diy focusrite if you have any link to learning resource those would be very much appreciated thanks,0
will frequently turning phantom power on/off damage my equipment hi i have an sm7b plugged into a cloudlifter which then go into a focusrite  if i turn the phantom power on/off will it damage anything the cloudlifter need phantom power to work from what i understand so it should just turn it off right i once joked with someone about using the phantom power switch on the interface a a mic on/off button and they said that it could damage the microphone would it,0
is there a specific reason why consumer microphone don't depreciate in price often i'm taking a look at the blue yeti and the at2020 both have been around the same price the last   year is this an effect of consumerism or do you suggest we either a don't have the audio tech to improve microphone around that price range b marginal benefit decrease so there's no point in improving audio quality if most buyer won't notice a difference,0
when using eq on dialogue doe subtle work or is it necessary to make strong correction i eq dialogue and i usually make very subtle cut and boost no more than  can the average listener actually hear this or am i wasting my time,0
why do guitar amp manufacturer advertise about how great their amps' bass frequency response is it's relatively common for guitar amp to be advertised using phrase like huge monstrous bass and other marketing term regarding the impressiveness of how bass frequency are reproduced by the amp is this a mere marketing gimmick oriented toward guitar player who either don't know or don't care how the amount of bass in their tone might interact negatively with the tone of the band's bassist when guitar amp manufacturer advertise how great the bass response of their amp is are they also necessarily referring to the extent to which their amp will compete with a bass guitar i guess my question is whether an amp being advertised a having huge bass could translate into anything musically useful in the context of a band without necessitating that the bass guitar take up le space if bass simply mean frequency from roughly  hz to  doesn't any advertisement about a guitar amp great bass presence mean that the bass guitar will have to be attenuated to compensate,0
mastering for spotify i've been working on a song for a friend of mine and he want to upload it to spotify via distrokid however reading i've done suggests that spotify limit track to  lufs while the track i'm working on is currently peaking just under there however it is very quiet in comparison to a lot of stuff i've listened to or even my own music on there with the peak being around  on the level my issue is that it's a very dense mix with a punk rock vibe low end rumble taken out all the high end that wasn't audible in the mix shelved off i've done everything i can to make sure everything is audible and i'm happy with how it's sounding but it's just too quiet relative to everything else on the platform the only option i can see is to turn the limiter gain up but that will compromise the mix which i'm happy with what do i do edit thank you to everyone that chimed in it's been a really useful learning experience,0
is there a free calculator for determining the subjective tone from  frequency wave link to what i'm talking about   phy astr gsu edu/hbase/sound/subton html c1 essentially i want to be able to put in f1 f2 fn and phase a percent for each wave and get a list of subjective tone with beat and frequency information i've tried google but could only find above resource,0
which bass trap design should i choose if i am using  rockwool i'm doing an across the board acoustic treatment of my loft i recently came into   foot of   inch thick rockwool from a cladding company that didn't need it any more and were selling it off cheap i'm sorted for ceiling cloud reflection point rear wall i know what i'm doing with them the place i'm struggling to make a decision is with my corner bass trap design particularly the floor to ceiling corner i have enough rockwool to stack triangle in every corner floor to ceiling and build a frame and cover them with fabric but this is obviously a lot more effort than just building panel and having the straddle the corner with an air gap now the rockwool i have is pretty dense and heavy i just weighed a  x  x  panel and it wa   foot x  foot x  inch   pound an online calculator tell me that the density is therefore  what is the best thing to do in term of my corner bass trap with dense rockwool like this,0
what are some pro and con of audio engineering i have to start applying to college soon and need to make my decision i have always been between audio engineering and aviation pilot or atc worker obviously this sub is going to side with audio engineering but i want your reasoning why you love and/or hate your job,0
