post_lm,is_ls
tech support and troubleshooting december   welcome the  tech support and troubleshooting thread we kindly ask that all tech support question and basic troubleshooting question how do i hook up 'a' to 'b' headphone v mon etc go here if you see post that belong here please report them to help u get to them in a timely manner thank you daily thread monday gear recommendation sticky thread   reddit  q title  author  restrict_sr on sort new t all monday tech support and troubleshooting sticky thread   reddit  q title  author  restrict_sr on sort new t all tuesday tip trick   reddit  q title    and   or author   restrict_sr on sort new t all friday how did they do that   reddit  q title  author  restrict_sr on sort new t all,0
gear recommendation what should i buy thread december   welcome to our weekly gear recommendation thread where you can ask  for recommendation on smart purchase low cost gear and purchasing recommendation request have become common in the ae subreddit there is also great repetition of model asked about and advised for use this weekly post is intended to assist in centralizing and answering request and recommendation if you see post that belong here please report them to help u get to them in a timely manner thank you daily thread monday gear recommendation sticky thread   reddit  q title  author  restrict_sr on sort new t all monday tech support and troubleshooting sticky thread   reddit  q title  author  restrict_sr on sort new t all tuesday tip trick   reddit  q title    and   or author   restrict_sr on sort new t all friday how did they do that   reddit  q title  author  restrict_sr on sort new t all,0
is a thunderbolt audio interface worth it for a small home studio right now i record through a crappy audiobox usb from many year ago and feel it s time to upgrade i play a fender strat and have a moog mono synth and elektron s digitone digitakt and analog four this leaf me needing preferably  input a i ll probably route one elektron into the other at a minimum i d also like a bit of room for expansion so let s say max even in a few year i ll need  input even if i need a secondary preamp is thunderbolt worth it or should i save some cash and just go for usb i m looking for an improvement in sound quality better preamps and also a reduction in noise which could be completely my fault and not the audiobox usb s i ve still got a few thing to try and get rid of the noise my biggest pet peeve though is the latency between playback and input so when i want to jam over something i recorded i have to put the mixer in the center and everything ha a huge delay on it which is terrible for my productivity and the volume are low overall hearing wise the direct to daw input is very enticing for me but i still do not know if it is worth the   any help is appreciated,0
what s the difference b/w dithering and truncation it s my basic understanding that dithering is adding low inaudible noise to cut off distortion and that it s the final step to the mastering process while truncation is simply cutting off bit resolution which in turn creates quantization error am i right,0
getting wide auto panning to sound right/auto panning trick tip i ve noticed that a lot of song i really enjoy use a good bit of auto panning dave fridmann seems to really like using it the sound tend to be shaker tambourine or higher pitched dreamy sounding synths i tend to have a hard time making auto panned sound fit in the mix well the element easily start to seem too on top of the mix one dimensional and obnoxious i have tried widening the sound before and after auto panning i ve also tried using reverb after the auto panning but i still am not getting the sound i m looking for in most case do you have any auto panning tip or trick how do you get it to add movement and excitement in your mix without sounding overbearing,0
how do you separate multi track's onto different desk channel sorry if this is the wrong sub or a really stupid question but planning to buy some equipment and set up a home studio not really a studio to get a grip with the really in depth mixing and eq stuff obviously without any live input this will rely on multi track i dont understand how it can go from the main file to being patched onto different desk channel surely the desk still see it a one input a it will just be a signal from a laptop is it software that can separate it up so the desk see it a different input again sorry if it's a very obvious question we are mainly based around live sound and don't really do much software/pre recorded work thanks in advance,0
static hiss coming from laptop when using headphone i have a laptop that i can hear noise from when there should be silence i can deal with it when listening to music or watching video but it's kind of annoying when producing or mixing i have an interface that i can plug in and that solves it but i don't like to carry it around all the time i wa wondering if a usb headphone amp like this   amazon com/fiio portable headphone amplifier dac/dp/b0189evgag/ref mp_s_a_1_16 ie utf8 qid  sr   pi ac_sx236_sy340_fmwebp_ql65 keywords fiio headphone amp would likely solve the issue the noise is not always there but any time i have a video/audio application running it will be there even if it's not in play mode the second i close those program it's gone,0
suggestion for isolating small studio room on a budget hi all opened up my new mixing room here in brooklyn and i'm trying to figure out the cheapest most efficient way to isolate the noise in my room and prevent it from hitting my neighbor i'm in a multi faceted studio building with many tenant and i have  neighbor on either side of me turn out the wall do not have any insulation installed between them only  panel of sheetrock against stud my room is  sf it's small but it's enough for what i do so i don't really have the space to build a room within room setup i've already been lectured about how having more mass will be the best solution but i just don't have that kind of space i'm looking for a solution that will at least dampen my output to the neighbor p s i considered posting to r/acoustics but their community is a lot smaller than this one so i figured i'd give it a shot here,0
confusion about automation in general hey guy i feel like a lot of famous audio engineering say that good automation is going to make the biggest difference between an amateur mix and a professional one i can see why people say this but i'm still not sure what exactly i'm supposed to be automating what am i supposed to be trying to achieve with automation thanks,0
gold star studio chamber isolated ronettes recording i'm a fanatic for that old gold star/phil spector sound and i just heard this for the first time the clap at the beginning and ronnie's opening woah oh s might be the cleanest isolated example of the sound and long decay of the chamber at gold star the tail overlap but it sound like it might be at least a good  second edit i got a rough estimate from one of the long clap and counting/converting the bpm and it's around   second at least on a cell phone speaker   be/zm4wljd6clg,0
best engineered album of  i remember a thread like this last year but haven t seen one yet a couple to start jon hopkins singularity shygirl cruel practice,0
question about level clipping while mixing drum tried this in another sub but got no response please let me know if this is more appropriate in another sub firstly it it's worth mentioning i'm using reaper on window  wondering if anyone else ha this issue while mixing specifically with drum first off i make sure i record my level peaking  i take time to make sure my source is the best it can be before it go into the daw when i'm mixing i watch my level and main fader to make sure i'm not peaking above  and yet my drum can't stop clipping the only effect i'm adding on my  track are eq light compression and light reverb i don't hear clipping they sound good but i have to either turn down my main fader like   to avoid seeing the level clip or turn down the individual faders a lot the other problem i have is when i do have a good drum sound when i slowly begin to ease my other instrument in the drum become buried in the mix and it make it feel like all the processing i did is never heard if i do hear the drum i have to keep my instrument down but then that make the mix sound sort of lop sided and weak i also use high pas filter on my guitars/vocals and generally try to remove any unnecessary frequency but i'm still learning at using a fully parametric visual eq effectively appreciate any suggestion or input thanks,0
diy dsp like soundgrid the idea of having a dedicated server to handle my plug in seems really great but soundgrid is a commitment that i m not ready to make i m curious if it s possible to run a rig similar to this where my plug in can be processed on another device that s linked to my host computer via ethernet i m sure it s a long shot but if it s possible i m down for the challenge,0
avantone cv  x kaotica eyeball hey guy just curious if anyone ha used these two together to record vocal if so have any example of what it sound like i am thinking of getting these two to record an artist i work with he make hip hop/rap thanks in advance,0
new door for home studio ive already treated the room acoustically now the only thing left to tackle is the door it s just a standard hollow door at the moment and i want to replace it with a nice solid door what is my best bet for this by the way i have seen studio door being sold but they re like  cheapest,0
some question before i start mixing my band's somewhat dense post rock ish ep i'm about to start mixing my new band 's new music and thought i 'd spew some question to hopefully guide me well i've always mixed my band and always thought they turned out pretty decent but could be better any general tip on semi dense music containing section with  reverb/delay laden guitar all double mic 'd an sm57 and a fathead sometimes a more rhythmic part along with a lead sometimes just  or  riffy/arpeggio'd part sometimes two rhythmic part with kind of alternating high note so the rhythm s contain the lead basically tip on parsing thing like that and placing them well and all that more specific question i see often people saying to mix in mono to place everything in the right spot frequency wise that make sense but i feel like multiple guitar part require panning i mean you don 't often cut frequency in one guitar to make room for another do you or do you and either way is mixing in mono to start with a universally agreed upon method or are there downside should i do it with all the non guitar instrument and carve out a spot for all the guitar to live then pan to get the guitar sounding good i've never tried starting in mono we 're using programmed drum with superior drummer i think i've got them sounding pretty natural by sending them all to the same reverb and with superior drummer 's humanizing stuff but any other tip for making unreal drum sound real other than the programming itself i feel like in more emotional le steady and rocking music the kick should be more felt than heard is this a common belief whenever i can hear the click really clearly in post rock music it feel weird am i alone in that any tip for mixing kick if you were to approach mixing a band like explosion in the sky but with vocal what would you do with the vocal to still make them clear while also not detracting too much from the music i've seen band go to both extreme like appleseed cast had an album where the vocal were heavily effected and foxing had an album where the vocal were up front and clear maybe somewhere in between what do you think my band have always suffered from being music for musician and i 'm trying to change that with this one by making it a little more accessible in the mix to me that mean clearer and more up front vocal but i do want the musical subtlety and stuff to come through since that really is our focus i don 't know if this break rule  hopefully not since i asked a lot of specific question but here 's a rough mix of one of our song to give an idea of our style any general thought on what you 'd do different would be great i have plenty of issue with this mix sibilance drum and just a bunch of tweak i 'd make but would love to hear your thought a i think a lot of mixing advice is geared towards making like rock music and i don 't feel like that 's really what we are   bandcamp com/track/gold   bandcamp com/track/gold thanks,0
this pantheon style cathedral allows for a  second reverb which make singing sound even more beautiful   redd it/sku6jb5bbx421,0
missing  in my mix i wa comparing a mix of mine to a commercial release by lufs matching the two track and then comparing key frequency band i found that all frequency band were within /  of the commercial release except for the  range which wa much quieter in my mix than in the commercial release are there any very common reason for this to occur my best guess are  the commercial release had somewhat more electronic instrumentation would the overtone of these instrument reach higher than other non electronic instrument  the commercial release wa a lossy format while my mix wa a wav file could the lossy format add information distortion in the  range  are commercial mix often given a big  eq boost on the mix bus  with regard to frequency greater than  am i just generally stupid and deficient,0
how can audacity help me fix a dialogue that i recorded inside of a car thank you,0
how much soundproofing do you actually need for vocal i've been looking at option for soundproofing creating a small booth putting huge blanket all over the place but it all seems a bit overkill for what i actually need it for it's only for vocal i live in a terrace house and the wall are kinda thin so it make me really self conscious about singing loud so it limit my range i've even thought about making a small soundproof box to put over my head a ridiculous a it sound at least it would get the job done and it would probably be cheap to make though i'm sure there would be issue with comb filtering and airflow i bet so how much soundproofing do you even need for a voice to stop it travelling through the wall,0
possibly the dumbest question ever posted here but how do you get a reference track okay so before you laugh to hard all of the music i have is either streaming or from itunes streaming obviously come across in low quality and i cant set it in my project purchase from itunes do not give you  wave file which honestly i do not know if that is necessary or not i could pull a song off youtube but again low quality so where do i get reference track and what quality / file format is necessary for it to be a good reference,0
question about phase i understand the importance of making sure mics are in phase during both recording and mixing but when working itb is there any reason you can't just zoom in on the waveform and line up peak with peaks/troughs with trough visually i see a lot of dude using plugins like sound radix auto align for lining up polarity but it seems like an unnecessary gadget when you can just get different source in phase by referencing sharp transient across several track i e a rimshot on the snare i did this on a project recently and really beefed up a snare in a way that simply flipping the polarity couldn't accomplish any input or just general phase discussion much appreciated,0
starting out freelancing i wa wondering if there have any tips/tricks or resource to start out freelancing a an audio engineering,0
old firewire equipment to thunderbolt hey all i have an old presonus firestudio project device that output with ieee  i cannot figure out a way to adapt it to usbc thunderbolt or usb3 any idea on adapter if i did find a way to adapt would it likely be buggy or have a loss in quality i might just have to get new equipment but it stink because the old equipment worked great and suited my purpose thanks for any insight,0
wave free mixing course with dave darlington / reference track question just found this sub today and i m glad because i really want to become the best audio producer/mixer guy i possibly can i ve been self producing/mixing a record for  month ive done several record in the past ten year but this is the most seriously i ve ever taken it i am of course also the artist and the writer and blah blah we are in the age of many hat wondering if anyone ha watched this wave series i ve found it extremely useful not always gonna have all the plugins mentioned but just watching pro go at it and talk about their process and why they make their choice is really cool i m not done watching them really but one question that really stand out to me is this when using a reference track wouldn t that track already be mastered how is it helpful to reference a fully mastered track with a track that s in the mix phase like it feel like using a mainstream released track for reference when mastering make sense but how are we supposed to get hold of the mix,0
power adapter question for audio interface i just bought an old used scarlett  and it didn t include the power adapter i plugged in a  adapter rated for  and all i saw in the mixcontrol software wa a full meter of static on every analog channel it s asking for   so i assume that the static wa a result of under powering the device my local best buy sell an ac dc adapter variable voltage up to  and rated for   will this power adapter work for my interface i assume that even though it s rated for   the interface will only draw a much current a it need is there a flaw in my logic here also do you think i m correct in my theory that the static on every channel is due to under powering the interface the seller said that it wa fully functional and he had a number of good review thanks update   power supply worked great thankfully it look like under powering via current didn't do any damage i ended up grabbing the variable voltage power supply just for the sake of having a spare around and am planning to order one specifically for the ,0
tip trick tuesday december   welcome to the weekly tip and trick post offer your own or ask for example how do you get a great sound for vocal or guitar what maintenance do you do on a regular basis to keep your gear in shape what is the most successful thing you've done to get client in the door daily thread monday gear recommendation sticky thread   reddit  q title  author  restrict_sr on sort new t all monday tech support and troubleshooting sticky thread   reddit  q title  author  restrict_sr on sort new t all tuesday tip trick   reddit  q title    and   or author   restrict_sr on sort new t all friday how did they do that   reddit  q title  author  restrict_sr on sort new t all upvoting is a good way of keeping this thread active and on the front page for more than one day,0
do you guy like video about music production i love watching artist go through how they create their music and i've made /r/musicproductionvideos a a central resource for finding video on producing i hope you'll come over and share your favorite video mixing video are very welcome,0
audio interface routing software is there a universal type of software that make it easy to route thing to and from the ins/outs of an interface i have a behringer interface umc204 that work fine but it doesn t seem to have any support for software like i see people using with focusrite and other brand i m considering getting a bigger interface but i want to get one that is able to configure input and out put the way i want is this just a cost saving thing for behringer and other brand have always had it do i even need it using reaper if that help,0
how do you personally use track sends in a daw are the typical dual send knob per track in daw an obsolete artifact from analog day or am i missing out by not using them i don't use them when i want reverb on a track i add it to that track and tailor it for that track same with any other audio effect i get how they are essential on analog when i have only limited hardware but a software effect can be multiplied almost indefinitely so we don't need to share one effect configuration between multiple track so is the way they are incorporated into daw vestigial or is there still importance behind shared effect over individual is there a way i could be effectually using the sends can having the same effect on multiple track somehow pull a song together in some way or is it simply just for the convenience of well i always set my whatever effect the same no matter what so might a well just do it once edit whoa glad i asked i'm learning a lot thanks for the info,0
noise reduction with multiple recotdings i recorded a concert today with the only microphone being used the internal one in two camera and a phone mic this wa an all of a sudden thing what i'm thinking now is can i somehow combine the recording to make a clearer sound how should i go about this,0
mixing drum for beginner hi iam new into the world of mixing i wa asking myself is it better to put a compressor on the drum master track or compress each individual part like kick tom snare etc iam having a hard time to get my mix sound fuller my mix sound dry without no life just so you know i play death/black metal and iam using reaper daw with bias fx and superior drummer  for the eq's and stuff iam using only the free plugins that comme with reaper if you could recommend me mixing plugins that would help me i will be more than willing to pay for them thank you,0
what blog should i follow for tip and be updated hey guy i'm new to audio i'm learning production so i wanted to know the famous blogger and channel for mixing mastering and production i checked the izotope website they have some good blog post but  of them are promotion post so suggest me some website or blogger or youtube channel,0
scarlet  extra input i read that the s/pdif input on the scarlett  can be used for two input channel i'm wondering if there's any way to connect the   headphone output of my digital piano to it to save an extra two input for other thing is there any sort of   to coaxial s/pdif converter,0
how do you start your drum mix why do you start with the room and blend in the direct mics do you start with overhead do you slam the room mics how do you decide where to pan the overhead etc more importantly why do you make the decision you do while mixing drum what informs the decision you make genre style feeling,0
loud but not crushing transient hey everyone been producing electronic music for  year now ive read a lot on trying to get a loud master ive picked up a few thing such a a loud master depends on a really good mixdown etc while all this is good i still am not able to get the loudness i would like i listen to some of these guy track and am blown away at how loud they can push their track without clipping their drum transient and squashing the absolute life out of their track i guess my biggest question is how do i get my master loud but to where the drum are still clear and aren't crushed to death ill post some track below for reference im sorry i know this question ha been answered probably a thousand time i just can't find anything that ha really stuck with me over the year appreciate any reply   com/mvrdauk/break and fall   super tight kick and punchy snare anytime i try and make my drum sound like that then try and get loud on the master it fucking ruin them and drastically alters the sound   com/mvrdauk/frontline  second   com/theofficialtrilla/playcard black ops xl  second,0
frequency to avoid on iphone i ve been referencing a track i made on various device and it sound pretty good everywhere apart from my iphone the kick in particular almost ha a clipping sound when played out of the phone speaker on the ipad it sound fine and also fine on headphone and my monitor just on the phone anyone had this before it s kinda buggin me and i m not sure if it s my mix or the phone not handling a certain frequency to good,0
are behringer product that bad i feel like having behringer product is kind of a taboo in live mixing not sure if it applies to studio work at my school we have a x32 and it work the build quality is bad imo we almost destroyed some input because the connector are bad software isn't that great they did improve it though but it work it doe the audio processing and sends it out now in the end we all want to work with the best stuff available out there problem will always be budget if my school had unlimited money we would be working with grandma's and stuff but they don't so for someone with a tight budget behringer doe a really good job at keeping price low while deliviering decent/good product how are your opinion about this what is the problem with having behringer product,0
cut eq gt compression gt boost eq i've been getting into the technique of cutting the frequency you dont want before you compress and then boost after compression let's say you're working on a snare drum cut eq you high pas around  hz and cut  hz at  db you now throw in your compressor set your attack release etc boost eq now in come your  eq for boosting boost  hz and  hz my question is if your  eq is meant for boosting and the cutting portion wa done by the first eq before compression won't all the cutting be reintroduced since those frequency were left alone in that  eq,0
